{
  "address": "0xa714cb28ECc47aCc139C300A8BAdCBe1E86297d3",
  "abi": [
    {
      "anonymous": false,
      "inputs": [
        {
          "indexed": true,
          "internalType": "uint256",
          "name": "termId",
          "type": "uint256"
        },
        {
          "indexed": true,
          "internalType": "address",
          "name": "user",
          "type": "address"
        },
        {
          "indexed": true,
          "internalType": "uint256",
          "name": "amount",
          "type": "uint256"
        }
      ],
      "name": "OnWithdrawnBalanceRestored",
      "type": "event"
    },
    {
      "anonymous": false,
      "inputs": [
        {
          "indexed": true,
          "internalType": "uint256",
          "name": "termId",
          "type": "uint256"
        },
        {
          "indexed": true,
          "internalType": "address",
          "name": "user",
          "type": "address"
        },
        {
          "indexed": true,
          "internalType": "bool",
          "name": "optedIn",
          "type": "bool"
        }
      ],
      "name": "OnYGOptInToggled",
      "type": "event"
    },
    {
      "anonymous": false,
      "inputs": [
        {
          "indexed": true,
          "internalType": "uint256",
          "name": "termId",
          "type": "uint256"
        },
        {
          "indexed": true,
          "internalType": "address",
          "name": "user",
          "type": "address"
        },
        {
          "indexed": false,
          "internalType": "address",
          "name": "receiver",
          "type": "address"
        },
        {
          "indexed": true,
          "internalType": "uint256",
          "name": "amount",
          "type": "uint256"
        }
      ],
      "name": "OnYieldClaimed",
      "type": "event"
    },
    {
      "anonymous": false,
      "inputs": [
        {
          "indexed": true,
          "internalType": "uint256",
          "name": "termId",
          "type": "uint256"
        },
        {
          "indexed": true,
          "internalType": "address",
          "name": "user",
          "type": "address"
        },
        {
          "indexed": true,
          "internalType": "uint256",
          "name": "amount",
          "type": "uint256"
        }
      ],
      "name": "OnYieldCompensated",
      "type": "event"
    },
    {
      "anonymous": false,
      "inputs": [
        {
          "indexed": true,
          "internalType": "uint256",
          "name": "termId",
          "type": "uint256"
        },
        {
          "indexed": true,
          "internalType": "address",
          "name": "user",
          "type": "address"
        },
        {
          "indexed": true,
          "internalType": "uint256",
          "name": "amount",
          "type": "uint256"
        }
      ],
      "name": "OnYieldReimbursed",
      "type": "event"
    },
    {
      "anonymous": false,
      "inputs": [
        {
          "indexed": true,
          "internalType": "uint256",
          "name": "termId",
          "type": "uint256"
        },
        {
          "indexed": true,
          "internalType": "uint256",
          "name": "amountRestored",
          "type": "uint256"
        },
        {
          "indexed": true,
          "internalType": "uint256",
          "name": "amountCompensated",
          "type": "uint256"
        }
      ],
      "name": "OnYieldTermUpdated",
      "type": "event"
    },
    {
      "inputs": [
        {
          "internalType": "uint256",
          "name": "termId",
          "type": "uint256"
        },
        {
          "internalType": "address",
          "name": "receiver",
          "type": "address"
        }
      ],
      "name": "claimAvailableYield",
      "outputs": [],
      "stateMutability": "nonpayable",
      "type": "function"
    },
    {
      "inputs": [
        {
          "internalType": "uint256[]",
          "name": "termIds",
          "type": "uint256[]"
        }
      ],
      "name": "reimburseExtraYield",
      "outputs": [],
      "stateMutability": "nonpayable",
      "type": "function"
    },
    {
      "inputs": [
        {
          "internalType": "uint256[]",
          "name": "termIds",
          "type": "uint256[]"
        },
        {
          "internalType": "uint256[]",
          "name": "originalWithdrawals",
          "type": "uint256[]"
        },
        {
          "internalType": "uint256[]",
          "name": "originalShares",
          "type": "uint256[]"
        },
        {
          "internalType": "address[]",
          "name": "users",
          "type": "address[]"
        }
      ],
      "name": "rescueStuckYields",
      "outputs": [],
      "stateMutability": "payable",
      "type": "function"
    },
    {
      "inputs": [
        {
          "internalType": "uint256[]",
          "name": "termIds",
          "type": "uint256[]"
        }
      ],
      "name": "restoreYieldBalance",
      "outputs": [],
      "stateMutability": "payable",
      "type": "function"
    },
    {
      "inputs": [
        {
          "internalType": "uint256",
          "name": "termId",
          "type": "uint256"
        }
      ],
      "name": "toggleOptInYG",
      "outputs": [],
      "stateMutability": "nonpayable",
      "type": "function"
    },
    {
      "inputs": [],
      "name": "toggleYieldLock",
      "outputs": [
        {
          "internalType": "bool",
          "name": "",
          "type": "bool"
        }
      ],
      "stateMutability": "nonpayable",
      "type": "function"
    },
    {
      "inputs": [
        {
          "internalType": "uint256",
          "name": "termId",
          "type": "uint256"
        },
        {
          "internalType": "string",
          "name": "providerString",
          "type": "string"
        },
        {
          "internalType": "address",
          "name": "providerAddress",
          "type": "address"
        }
      ],
      "name": "updateProviderAddressOnTerms",
      "outputs": [],
      "stateMutability": "nonpayable",
      "type": "function"
    },
    {
      "inputs": [
        {
          "internalType": "string",
          "name": "providerString",
          "type": "string"
        },
        {
          "internalType": "address",
          "name": "providerAddress",
          "type": "address"
        }
      ],
      "name": "updateYieldProvider",
      "outputs": [],
      "stateMutability": "nonpayable",
      "type": "function"
    }
  ],
  "transactionHash": "0x263e25951e42d6ddf8f5442ef0ffe49ea9d32b7120f7acb9789ddce92267d3a3",
  "receipt": {
    "to": null,
    "from": "0xf39Fd6e51aad88F6F4ce6aB8827279cffFb92266",
    "contractAddress": "0xa714cb28ECc47aCc139C300A8BAdCBe1E86297d3",
    "transactionIndex": 0,
    "gasUsed": "2091882",
    "logsBloom": "0x00000000000000000000000000000000000000000000000000000000000000000000000000000000000000000000000000000000000000000000000000000000000000000000000000000000000000000000000000000000000000000000000000000000000000000000000000000000000000000000000000000000000000000000000000000000000000000000000000000000000000000000000000000000000000000000000000000000000000000000000000000000000000000000000000000000000000000000000000000000000000000000000000000000000000000000000000000000000000000000000000000000000000000000000000000000",
    "blockHash": "0x85257995ac44db43b4d499a3aa3e2e0b41d576178bc10e2e11f7557019299678",
    "transactionHash": "0x263e25951e42d6ddf8f5442ef0ffe49ea9d32b7120f7acb9789ddce92267d3a3",
    "logs": [],
    "blockNumber": 178499674,
    "cumulativeGasUsed": "2091882",
    "status": 1,
    "byzantium": true
  },
  "args": [],
  "numDeployments": 2,
  "solcInputHash": "cc6a67fd244848db88c1ab4c8df510f4",
  "metadata": "{\"compiler\":{\"version\":\"0.8.18+commit.87f61d96\"},\"language\":\"Solidity\",\"output\":{\"abi\":[{\"anonymous\":false,\"inputs\":[{\"indexed\":true,\"internalType\":\"uint256\",\"name\":\"termId\",\"type\":\"uint256\"},{\"indexed\":true,\"internalType\":\"address\",\"name\":\"user\",\"type\":\"address\"},{\"indexed\":true,\"internalType\":\"uint256\",\"name\":\"amount\",\"type\":\"uint256\"}],\"name\":\"OnWithdrawnBalanceRestored\",\"type\":\"event\"},{\"anonymous\":false,\"inputs\":[{\"indexed\":true,\"internalType\":\"uint256\",\"name\":\"termId\",\"type\":\"uint256\"},{\"indexed\":true,\"internalType\":\"address\",\"name\":\"user\",\"type\":\"address\"},{\"indexed\":true,\"internalType\":\"bool\",\"name\":\"optedIn\",\"type\":\"bool\"}],\"name\":\"OnYGOptInToggled\",\"type\":\"event\"},{\"anonymous\":false,\"inputs\":[{\"indexed\":true,\"internalType\":\"uint256\",\"name\":\"termId\",\"type\":\"uint256\"},{\"indexed\":true,\"internalType\":\"address\",\"name\":\"user\",\"type\":\"address\"},{\"indexed\":false,\"internalType\":\"address\",\"name\":\"receiver\",\"type\":\"address\"},{\"indexed\":true,\"internalType\":\"uint256\",\"name\":\"amount\",\"type\":\"uint256\"}],\"name\":\"OnYieldClaimed\",\"type\":\"event\"},{\"anonymous\":false,\"inputs\":[{\"indexed\":true,\"internalType\":\"uint256\",\"name\":\"termId\",\"type\":\"uint256\"},{\"indexed\":true,\"internalType\":\"address\",\"name\":\"user\",\"type\":\"address\"},{\"indexed\":true,\"internalType\":\"uint256\",\"name\":\"amount\",\"type\":\"uint256\"}],\"name\":\"OnYieldCompensated\",\"type\":\"event\"},{\"anonymous\":false,\"inputs\":[{\"indexed\":true,\"internalType\":\"uint256\",\"name\":\"termId\",\"type\":\"uint256\"},{\"indexed\":true,\"internalType\":\"address\",\"name\":\"user\",\"type\":\"address\"},{\"indexed\":true,\"internalType\":\"uint256\",\"name\":\"amount\",\"type\":\"uint256\"}],\"name\":\"OnYieldReimbursed\",\"type\":\"event\"},{\"anonymous\":false,\"inputs\":[{\"indexed\":true,\"internalType\":\"uint256\",\"name\":\"termId\",\"type\":\"uint256\"},{\"indexed\":true,\"internalType\":\"uint256\",\"name\":\"amountRestored\",\"type\":\"uint256\"},{\"indexed\":true,\"internalType\":\"uint256\",\"name\":\"amountCompensated\",\"type\":\"uint256\"}],\"name\":\"OnYieldTermUpdated\",\"type\":\"event\"},{\"inputs\":[{\"internalType\":\"uint256\",\"name\":\"termId\",\"type\":\"uint256\"},{\"internalType\":\"address\",\"name\":\"receiver\",\"type\":\"address\"}],\"name\":\"claimAvailableYield\",\"outputs\":[],\"stateMutability\":\"nonpayable\",\"type\":\"function\"},{\"inputs\":[{\"internalType\":\"uint256[]\",\"name\":\"termIds\",\"type\":\"uint256[]\"}],\"name\":\"reimburseExtraYield\",\"outputs\":[],\"stateMutability\":\"nonpayable\",\"type\":\"function\"},{\"inputs\":[{\"internalType\":\"uint256[]\",\"name\":\"termIds\",\"type\":\"uint256[]\"},{\"internalType\":\"uint256[]\",\"name\":\"originalWithdrawals\",\"type\":\"uint256[]\"},{\"internalType\":\"uint256[]\",\"name\":\"originalShares\",\"type\":\"uint256[]\"},{\"internalType\":\"address[]\",\"name\":\"users\",\"type\":\"address[]\"}],\"name\":\"rescueStuckYields\",\"outputs\":[],\"stateMutability\":\"payable\",\"type\":\"function\"},{\"inputs\":[{\"internalType\":\"uint256[]\",\"name\":\"termIds\",\"type\":\"uint256[]\"}],\"name\":\"restoreYieldBalance\",\"outputs\":[],\"stateMutability\":\"payable\",\"type\":\"function\"},{\"inputs\":[{\"internalType\":\"uint256\",\"name\":\"termId\",\"type\":\"uint256\"}],\"name\":\"toggleOptInYG\",\"outputs\":[],\"stateMutability\":\"nonpayable\",\"type\":\"function\"},{\"inputs\":[],\"name\":\"toggleYieldLock\",\"outputs\":[{\"internalType\":\"bool\",\"name\":\"\",\"type\":\"bool\"}],\"stateMutability\":\"nonpayable\",\"type\":\"function\"},{\"inputs\":[{\"internalType\":\"uint256\",\"name\":\"termId\",\"type\":\"uint256\"},{\"internalType\":\"string\",\"name\":\"providerString\",\"type\":\"string\"},{\"internalType\":\"address\",\"name\":\"providerAddress\",\"type\":\"address\"}],\"name\":\"updateProviderAddressOnTerms\",\"outputs\":[],\"stateMutability\":\"nonpayable\",\"type\":\"function\"},{\"inputs\":[{\"internalType\":\"string\",\"name\":\"providerString\",\"type\":\"string\"},{\"internalType\":\"address\",\"name\":\"providerAddress\",\"type\":\"address\"}],\"name\":\"updateYieldProvider\",\"outputs\":[],\"stateMutability\":\"nonpayable\",\"type\":\"function\"}],\"devdoc\":{\"kind\":\"dev\",\"methods\":{\"claimAvailableYield(uint256,address)\":{\"details\":\"for emergency use only, in case the claimed yield is not sent to the user when withdrawing the collateral\",\"params\":{\"receiver\":\"The address of the user who will receive the yield\",\"termId\":\"The term id for which the yield is being claimed\"}},\"reimburseExtraYield(uint256[])\":{\"params\":{\"termIds\":\"The term ids for which the yield balance is to be restored\"}},\"rescueStuckYields(uint256[],uint256[],uint256[],address[])\":{\"params\":{\"originalShares\":\"The original calculated shares amounts of each bad transaction\",\"originalWithdrawals\":\"The original ETH withdrawal amounts of each bad transaction\",\"termIds\":\"The term ids for which the yield is being rescued\",\"users\":\"The users to be reimbursed\"}},\"restoreYieldBalance(uint256[])\":{\"params\":{\"termIds\":\"The term ids for which the yield balance is to be restored\"}},\"toggleOptInYG(uint256)\":{\"details\":\"only allowed before the term starts\",\"params\":{\"termId\":\"The term id for which the yield is being claimed\"}},\"updateProviderAddressOnTerms(uint256,string,address)\":{\"params\":{\"providerAddress\":\"The new address of the provider\",\"providerString\":\"The provider string for which the address is being updated\",\"termId\":\"The term id for which the yield is being claimed\"}},\"updateYieldProvider(string,address)\":{\"params\":{\"providerAddress\":\"The new address of the provider\",\"providerString\":\"The provider string for which the address is being updated\"}}},\"version\":1},\"userdoc\":{\"kind\":\"user\",\"methods\":{\"claimAvailableYield(uint256,address)\":{\"notice\":\"This function allows a user to claim the current available yield\"},\"reimburseExtraYield(uint256[])\":{\"notice\":\"To be used in case of emergency, when there are more shares deposited than expected\"},\"rescueStuckYields(uint256[],uint256[],uint256[],address[])\":{\"notice\":\"To be used in case of emergency, when yield got stuck in the vaultThe position of each array is used as a set in the calculation\"},\"restoreYieldBalance(uint256[])\":{\"notice\":\"To be used in case of emergency, when the user has withdrawn too much eth from yield into the smart contract\"},\"toggleOptInYG(uint256)\":{\"notice\":\"This function allows a user to toggle their yield generation\"},\"toggleYieldLock()\":{\"notice\":\"This function allows the owner to disable the yield generation feature in case of emergency\"},\"updateProviderAddressOnTerms(uint256,string,address)\":{\"notice\":\"To be used in case of emergency, when the provider needs to change the zap or the vault\"},\"updateYieldProvider(string,address)\":{\"notice\":\"This function allows the owner to update the global variable for new yield provider\"}},\"version\":1}},\"settings\":{\"compilationTarget\":{\"contracts/facets/YGFacetZaynFi.sol\":\"YGFacetZaynFi\"},\"evmVersion\":\"paris\",\"libraries\":{},\"metadata\":{\"bytecodeHash\":\"ipfs\",\"useLiteralContent\":true},\"optimizer\":{\"enabled\":true,\"runs\":200},\"remappings\":[]},\"sources\":{\"@openzeppelin/contracts/token/ERC20/IERC20.sol\":{\"content\":\"// SPDX-License-Identifier: MIT\\n// OpenZeppelin Contracts (last updated v4.9.0) (token/ERC20/IERC20.sol)\\n\\npragma solidity ^0.8.0;\\n\\n/**\\n * @dev Interface of the ERC20 standard as defined in the EIP.\\n */\\ninterface IERC20 {\\n    /**\\n     * @dev Emitted when `value` tokens are moved from one account (`from`) to\\n     * another (`to`).\\n     *\\n     * Note that `value` may be zero.\\n     */\\n    event Transfer(address indexed from, address indexed to, uint256 value);\\n\\n    /**\\n     * @dev Emitted when the allowance of a `spender` for an `owner` is set by\\n     * a call to {approve}. `value` is the new allowance.\\n     */\\n    event Approval(address indexed owner, address indexed spender, uint256 value);\\n\\n    /**\\n     * @dev Returns the amount of tokens in existence.\\n     */\\n    function totalSupply() external view returns (uint256);\\n\\n    /**\\n     * @dev Returns the amount of tokens owned by `account`.\\n     */\\n    function balanceOf(address account) external view returns (uint256);\\n\\n    /**\\n     * @dev Moves `amount` tokens from the caller's account to `to`.\\n     *\\n     * Returns a boolean value indicating whether the operation succeeded.\\n     *\\n     * Emits a {Transfer} event.\\n     */\\n    function transfer(address to, uint256 amount) external returns (bool);\\n\\n    /**\\n     * @dev Returns the remaining number of tokens that `spender` will be\\n     * allowed to spend on behalf of `owner` through {transferFrom}. This is\\n     * zero by default.\\n     *\\n     * This value changes when {approve} or {transferFrom} are called.\\n     */\\n    function allowance(address owner, address spender) external view returns (uint256);\\n\\n    /**\\n     * @dev Sets `amount` as the allowance of `spender` over the caller's tokens.\\n     *\\n     * Returns a boolean value indicating whether the operation succeeded.\\n     *\\n     * IMPORTANT: Beware that changing an allowance with this method brings the risk\\n     * that someone may use both the old and the new allowance by unfortunate\\n     * transaction ordering. One possible solution to mitigate this race\\n     * condition is to first reduce the spender's allowance to 0 and set the\\n     * desired value afterwards:\\n     * https://github.com/ethereum/EIPs/issues/20#issuecomment-263524729\\n     *\\n     * Emits an {Approval} event.\\n     */\\n    function approve(address spender, uint256 amount) external returns (bool);\\n\\n    /**\\n     * @dev Moves `amount` tokens from `from` to `to` using the\\n     * allowance mechanism. `amount` is then deducted from the caller's\\n     * allowance.\\n     *\\n     * Returns a boolean value indicating whether the operation succeeded.\\n     *\\n     * Emits a {Transfer} event.\\n     */\\n    function transferFrom(address from, address to, uint256 amount) external returns (bool);\\n}\\n\",\"keccak256\":\"0x287b55befed2961a7eabd7d7b1b2839cbca8a5b80ef8dcbb25ed3d4c2002c305\",\"license\":\"MIT\"},\"@openzeppelin/contracts/utils/structs/EnumerableSet.sol\":{\"content\":\"// SPDX-License-Identifier: MIT\\n// OpenZeppelin Contracts (last updated v4.9.0) (utils/structs/EnumerableSet.sol)\\n// This file was procedurally generated from scripts/generate/templates/EnumerableSet.js.\\n\\npragma solidity ^0.8.0;\\n\\n/**\\n * @dev Library for managing\\n * https://en.wikipedia.org/wiki/Set_(abstract_data_type)[sets] of primitive\\n * types.\\n *\\n * Sets have the following properties:\\n *\\n * - Elements are added, removed, and checked for existence in constant time\\n * (O(1)).\\n * - Elements are enumerated in O(n). No guarantees are made on the ordering.\\n *\\n * ```solidity\\n * contract Example {\\n *     // Add the library methods\\n *     using EnumerableSet for EnumerableSet.AddressSet;\\n *\\n *     // Declare a set state variable\\n *     EnumerableSet.AddressSet private mySet;\\n * }\\n * ```\\n *\\n * As of v3.3.0, sets of type `bytes32` (`Bytes32Set`), `address` (`AddressSet`)\\n * and `uint256` (`UintSet`) are supported.\\n *\\n * [WARNING]\\n * ====\\n * Trying to delete such a structure from storage will likely result in data corruption, rendering the structure\\n * unusable.\\n * See https://github.com/ethereum/solidity/pull/11843[ethereum/solidity#11843] for more info.\\n *\\n * In order to clean an EnumerableSet, you can either remove all elements one by one or create a fresh instance using an\\n * array of EnumerableSet.\\n * ====\\n */\\nlibrary EnumerableSet {\\n    // To implement this library for multiple types with as little code\\n    // repetition as possible, we write it in terms of a generic Set type with\\n    // bytes32 values.\\n    // The Set implementation uses private functions, and user-facing\\n    // implementations (such as AddressSet) are just wrappers around the\\n    // underlying Set.\\n    // This means that we can only create new EnumerableSets for types that fit\\n    // in bytes32.\\n\\n    struct Set {\\n        // Storage of set values\\n        bytes32[] _values;\\n        // Position of the value in the `values` array, plus 1 because index 0\\n        // means a value is not in the set.\\n        mapping(bytes32 => uint256) _indexes;\\n    }\\n\\n    /**\\n     * @dev Add a value to a set. O(1).\\n     *\\n     * Returns true if the value was added to the set, that is if it was not\\n     * already present.\\n     */\\n    function _add(Set storage set, bytes32 value) private returns (bool) {\\n        if (!_contains(set, value)) {\\n            set._values.push(value);\\n            // The value is stored at length-1, but we add 1 to all indexes\\n            // and use 0 as a sentinel value\\n            set._indexes[value] = set._values.length;\\n            return true;\\n        } else {\\n            return false;\\n        }\\n    }\\n\\n    /**\\n     * @dev Removes a value from a set. O(1).\\n     *\\n     * Returns true if the value was removed from the set, that is if it was\\n     * present.\\n     */\\n    function _remove(Set storage set, bytes32 value) private returns (bool) {\\n        // We read and store the value's index to prevent multiple reads from the same storage slot\\n        uint256 valueIndex = set._indexes[value];\\n\\n        if (valueIndex != 0) {\\n            // Equivalent to contains(set, value)\\n            // To delete an element from the _values array in O(1), we swap the element to delete with the last one in\\n            // the array, and then remove the last element (sometimes called as 'swap and pop').\\n            // This modifies the order of the array, as noted in {at}.\\n\\n            uint256 toDeleteIndex = valueIndex - 1;\\n            uint256 lastIndex = set._values.length - 1;\\n\\n            if (lastIndex != toDeleteIndex) {\\n                bytes32 lastValue = set._values[lastIndex];\\n\\n                // Move the last value to the index where the value to delete is\\n                set._values[toDeleteIndex] = lastValue;\\n                // Update the index for the moved value\\n                set._indexes[lastValue] = valueIndex; // Replace lastValue's index to valueIndex\\n            }\\n\\n            // Delete the slot where the moved value was stored\\n            set._values.pop();\\n\\n            // Delete the index for the deleted slot\\n            delete set._indexes[value];\\n\\n            return true;\\n        } else {\\n            return false;\\n        }\\n    }\\n\\n    /**\\n     * @dev Returns true if the value is in the set. O(1).\\n     */\\n    function _contains(Set storage set, bytes32 value) private view returns (bool) {\\n        return set._indexes[value] != 0;\\n    }\\n\\n    /**\\n     * @dev Returns the number of values on the set. O(1).\\n     */\\n    function _length(Set storage set) private view returns (uint256) {\\n        return set._values.length;\\n    }\\n\\n    /**\\n     * @dev Returns the value stored at position `index` in the set. O(1).\\n     *\\n     * Note that there are no guarantees on the ordering of values inside the\\n     * array, and it may change when more values are added or removed.\\n     *\\n     * Requirements:\\n     *\\n     * - `index` must be strictly less than {length}.\\n     */\\n    function _at(Set storage set, uint256 index) private view returns (bytes32) {\\n        return set._values[index];\\n    }\\n\\n    /**\\n     * @dev Return the entire set in an array\\n     *\\n     * WARNING: This operation will copy the entire storage to memory, which can be quite expensive. This is designed\\n     * to mostly be used by view accessors that are queried without any gas fees. Developers should keep in mind that\\n     * this function has an unbounded cost, and using it as part of a state-changing function may render the function\\n     * uncallable if the set grows to a point where copying to memory consumes too much gas to fit in a block.\\n     */\\n    function _values(Set storage set) private view returns (bytes32[] memory) {\\n        return set._values;\\n    }\\n\\n    // Bytes32Set\\n\\n    struct Bytes32Set {\\n        Set _inner;\\n    }\\n\\n    /**\\n     * @dev Add a value to a set. O(1).\\n     *\\n     * Returns true if the value was added to the set, that is if it was not\\n     * already present.\\n     */\\n    function add(Bytes32Set storage set, bytes32 value) internal returns (bool) {\\n        return _add(set._inner, value);\\n    }\\n\\n    /**\\n     * @dev Removes a value from a set. O(1).\\n     *\\n     * Returns true if the value was removed from the set, that is if it was\\n     * present.\\n     */\\n    function remove(Bytes32Set storage set, bytes32 value) internal returns (bool) {\\n        return _remove(set._inner, value);\\n    }\\n\\n    /**\\n     * @dev Returns true if the value is in the set. O(1).\\n     */\\n    function contains(Bytes32Set storage set, bytes32 value) internal view returns (bool) {\\n        return _contains(set._inner, value);\\n    }\\n\\n    /**\\n     * @dev Returns the number of values in the set. O(1).\\n     */\\n    function length(Bytes32Set storage set) internal view returns (uint256) {\\n        return _length(set._inner);\\n    }\\n\\n    /**\\n     * @dev Returns the value stored at position `index` in the set. O(1).\\n     *\\n     * Note that there are no guarantees on the ordering of values inside the\\n     * array, and it may change when more values are added or removed.\\n     *\\n     * Requirements:\\n     *\\n     * - `index` must be strictly less than {length}.\\n     */\\n    function at(Bytes32Set storage set, uint256 index) internal view returns (bytes32) {\\n        return _at(set._inner, index);\\n    }\\n\\n    /**\\n     * @dev Return the entire set in an array\\n     *\\n     * WARNING: This operation will copy the entire storage to memory, which can be quite expensive. This is designed\\n     * to mostly be used by view accessors that are queried without any gas fees. Developers should keep in mind that\\n     * this function has an unbounded cost, and using it as part of a state-changing function may render the function\\n     * uncallable if the set grows to a point where copying to memory consumes too much gas to fit in a block.\\n     */\\n    function values(Bytes32Set storage set) internal view returns (bytes32[] memory) {\\n        bytes32[] memory store = _values(set._inner);\\n        bytes32[] memory result;\\n\\n        /// @solidity memory-safe-assembly\\n        assembly {\\n            result := store\\n        }\\n\\n        return result;\\n    }\\n\\n    // AddressSet\\n\\n    struct AddressSet {\\n        Set _inner;\\n    }\\n\\n    /**\\n     * @dev Add a value to a set. O(1).\\n     *\\n     * Returns true if the value was added to the set, that is if it was not\\n     * already present.\\n     */\\n    function add(AddressSet storage set, address value) internal returns (bool) {\\n        return _add(set._inner, bytes32(uint256(uint160(value))));\\n    }\\n\\n    /**\\n     * @dev Removes a value from a set. O(1).\\n     *\\n     * Returns true if the value was removed from the set, that is if it was\\n     * present.\\n     */\\n    function remove(AddressSet storage set, address value) internal returns (bool) {\\n        return _remove(set._inner, bytes32(uint256(uint160(value))));\\n    }\\n\\n    /**\\n     * @dev Returns true if the value is in the set. O(1).\\n     */\\n    function contains(AddressSet storage set, address value) internal view returns (bool) {\\n        return _contains(set._inner, bytes32(uint256(uint160(value))));\\n    }\\n\\n    /**\\n     * @dev Returns the number of values in the set. O(1).\\n     */\\n    function length(AddressSet storage set) internal view returns (uint256) {\\n        return _length(set._inner);\\n    }\\n\\n    /**\\n     * @dev Returns the value stored at position `index` in the set. O(1).\\n     *\\n     * Note that there are no guarantees on the ordering of values inside the\\n     * array, and it may change when more values are added or removed.\\n     *\\n     * Requirements:\\n     *\\n     * - `index` must be strictly less than {length}.\\n     */\\n    function at(AddressSet storage set, uint256 index) internal view returns (address) {\\n        return address(uint160(uint256(_at(set._inner, index))));\\n    }\\n\\n    /**\\n     * @dev Return the entire set in an array\\n     *\\n     * WARNING: This operation will copy the entire storage to memory, which can be quite expensive. This is designed\\n     * to mostly be used by view accessors that are queried without any gas fees. Developers should keep in mind that\\n     * this function has an unbounded cost, and using it as part of a state-changing function may render the function\\n     * uncallable if the set grows to a point where copying to memory consumes too much gas to fit in a block.\\n     */\\n    function values(AddressSet storage set) internal view returns (address[] memory) {\\n        bytes32[] memory store = _values(set._inner);\\n        address[] memory result;\\n\\n        /// @solidity memory-safe-assembly\\n        assembly {\\n            result := store\\n        }\\n\\n        return result;\\n    }\\n\\n    // UintSet\\n\\n    struct UintSet {\\n        Set _inner;\\n    }\\n\\n    /**\\n     * @dev Add a value to a set. O(1).\\n     *\\n     * Returns true if the value was added to the set, that is if it was not\\n     * already present.\\n     */\\n    function add(UintSet storage set, uint256 value) internal returns (bool) {\\n        return _add(set._inner, bytes32(value));\\n    }\\n\\n    /**\\n     * @dev Removes a value from a set. O(1).\\n     *\\n     * Returns true if the value was removed from the set, that is if it was\\n     * present.\\n     */\\n    function remove(UintSet storage set, uint256 value) internal returns (bool) {\\n        return _remove(set._inner, bytes32(value));\\n    }\\n\\n    /**\\n     * @dev Returns true if the value is in the set. O(1).\\n     */\\n    function contains(UintSet storage set, uint256 value) internal view returns (bool) {\\n        return _contains(set._inner, bytes32(value));\\n    }\\n\\n    /**\\n     * @dev Returns the number of values in the set. O(1).\\n     */\\n    function length(UintSet storage set) internal view returns (uint256) {\\n        return _length(set._inner);\\n    }\\n\\n    /**\\n     * @dev Returns the value stored at position `index` in the set. O(1).\\n     *\\n     * Note that there are no guarantees on the ordering of values inside the\\n     * array, and it may change when more values are added or removed.\\n     *\\n     * Requirements:\\n     *\\n     * - `index` must be strictly less than {length}.\\n     */\\n    function at(UintSet storage set, uint256 index) internal view returns (uint256) {\\n        return uint256(_at(set._inner, index));\\n    }\\n\\n    /**\\n     * @dev Return the entire set in an array\\n     *\\n     * WARNING: This operation will copy the entire storage to memory, which can be quite expensive. This is designed\\n     * to mostly be used by view accessors that are queried without any gas fees. Developers should keep in mind that\\n     * this function has an unbounded cost, and using it as part of a state-changing function may render the function\\n     * uncallable if the set grows to a point where copying to memory consumes too much gas to fit in a block.\\n     */\\n    function values(UintSet storage set) internal view returns (uint256[] memory) {\\n        bytes32[] memory store = _values(set._inner);\\n        uint256[] memory result;\\n\\n        /// @solidity memory-safe-assembly\\n        assembly {\\n            result := store\\n        }\\n\\n        return result;\\n    }\\n}\\n\",\"keccak256\":\"0x9f4357008a8f7d8c8bf5d48902e789637538d8c016be5766610901b4bba81514\",\"license\":\"MIT\"},\"contracts/facets/YGFacetZaynFi.sol\":{\"content\":\"// SPDX-License-Identifier: GPL-3.0\\r\\n\\r\\npragma solidity 0.8.18;\\r\\n\\r\\nimport {IZaynZapV2TakaDAO} from \\\"../interfaces/IZaynZapV2TakaDAO.sol\\\";\\r\\nimport {IZaynVaultV2TakaDao} from \\\"../interfaces/IZaynVaultV2TakaDao.sol\\\";\\r\\n\\r\\nimport {IYGFacetZaynFi} from \\\"../interfaces/IYGFacetZaynFi.sol\\\";\\r\\n\\r\\nimport {LibYieldGenerationStorage} from \\\"../libraries/LibYieldGenerationStorage.sol\\\";\\r\\nimport {LibYieldGeneration} from \\\"../libraries/LibYieldGeneration.sol\\\";\\r\\nimport {LibCollateralStorage} from \\\"../libraries/LibCollateralStorage.sol\\\";\\r\\nimport {LibDiamond} from \\\"hardhat-deploy/solc_0.8/diamond/libraries/LibDiamond.sol\\\";\\r\\nimport {LibFundStorage} from \\\"../libraries/LibFundStorage.sol\\\";\\r\\n\\r\\ncontract YGFacetZaynFi is IYGFacetZaynFi {\\r\\n    event OnYGOptInToggled(uint indexed termId, address indexed user, bool indexed optedIn); // Emits when a user succesfully toggles yield generation\\r\\n    event OnYieldClaimed(\\r\\n        uint indexed termId,\\r\\n        address indexed user,\\r\\n        address receiver,\\r\\n        uint indexed amount\\r\\n    ); // Emits when a user claims their yield\\r\\n    event OnYieldReimbursed(uint indexed termId, address indexed user, uint indexed amount);\\r\\n    event OnYieldCompensated(uint indexed termId, address indexed user, uint indexed amount);\\r\\n    event OnWithdrawnBalanceRestored(\\r\\n        uint indexed termId,\\r\\n        address indexed user,\\r\\n        uint indexed amount\\r\\n    );\\r\\n    event OnYieldTermUpdated(\\r\\n        uint indexed termId,\\r\\n        uint indexed amountRestored,\\r\\n        uint indexed amountCompensated\\r\\n    );\\r\\n\\r\\n    modifier onlyOwner() {\\r\\n        LibDiamond.enforceIsContractOwner();\\r\\n        _;\\r\\n    }\\r\\n\\r\\n    /// @notice This function allows a user to claim the current available yield\\r\\n    /// @param termId The term id for which the yield is being claimed\\r\\n    /// @param receiver The address of the user who will receive the yield\\r\\n    /// @dev for emergency use only, in case the claimed yield is not sent to the user when withdrawing the collateral\\r\\n    function claimAvailableYield(uint termId, address receiver) external {\\r\\n        LibFundStorage.Fund storage fund = LibFundStorage._fundStorage().funds[termId];\\r\\n\\r\\n        address[] memory participants = fund.beneficiariesOrder;\\r\\n        uint participantsLength = participants.length;\\r\\n        bool canCall;\\r\\n\\r\\n        for (uint i; i < participantsLength; ) {\\r\\n            if (participants[i] == msg.sender) {\\r\\n                canCall = true;\\r\\n                break;\\r\\n            }\\r\\n\\r\\n            unchecked {\\r\\n                ++i;\\r\\n            }\\r\\n        }\\r\\n\\r\\n        require(canCall, \\\"The caller must be a participant\\\");\\r\\n\\r\\n        LibYieldGeneration._claimAvailableYield(termId, msg.sender, receiver);\\r\\n    }\\r\\n\\r\\n    /// @notice This function allows a user to toggle their yield generation\\r\\n    /// @dev only allowed before the term starts\\r\\n    /// @param termId The term id for which the yield is being claimed\\r\\n    function toggleOptInYG(uint termId) external {\\r\\n        LibYieldGenerationStorage.YieldGeneration storage yield = LibYieldGenerationStorage\\r\\n            ._yieldStorage()\\r\\n            .yields[termId];\\r\\n        LibCollateralStorage.Collateral storage collateral = LibCollateralStorage\\r\\n            ._collateralStorage()\\r\\n            .collaterals[termId];\\r\\n\\r\\n        require(\\r\\n            collateral.state == LibCollateralStorage.CollateralStates.AcceptingCollateral,\\r\\n            \\\"Too late to change YG opt in\\\"\\r\\n        );\\r\\n        require(\\r\\n            collateral.isCollateralMember[msg.sender],\\r\\n            \\\"Pay the collateral security deposit first\\\"\\r\\n        );\\r\\n\\r\\n        bool optIn = !yield.hasOptedIn[msg.sender];\\r\\n        yield.hasOptedIn[msg.sender] = optIn;\\r\\n        emit OnYGOptInToggled(termId, msg.sender, optIn);\\r\\n    }\\r\\n\\r\\n    /// @notice This function allows the owner to update the global variable for new yield provider\\r\\n    /// @param providerString The provider string for which the address is being updated\\r\\n    /// @param providerAddress The new address of the provider\\r\\n    function updateYieldProvider(\\r\\n        string memory providerString,\\r\\n        address providerAddress\\r\\n    ) external onlyOwner {\\r\\n        LibYieldGenerationStorage.YieldProviders storage yieldProvider = LibYieldGenerationStorage\\r\\n            ._yieldProviders();\\r\\n\\r\\n        yieldProvider.providerAddresses[providerString] = providerAddress;\\r\\n    }\\r\\n\\r\\n    /// @notice This function allows the owner to disable the yield generation feature in case of emergency\\r\\n    function toggleYieldLock() external onlyOwner returns (bool) {\\r\\n        bool newYieldLock = !LibYieldGenerationStorage._yieldLock().yieldLock;\\r\\n        LibYieldGenerationStorage._yieldLock().yieldLock = newYieldLock;\\r\\n\\r\\n        return LibYieldGenerationStorage._yieldLock().yieldLock;\\r\\n    }\\r\\n\\r\\n    /// @notice To be used in case of emergency, when the provider needs to change the zap or the vault\\r\\n    /// @param termId The term id for which the yield is being claimed\\r\\n    /// @param providerString The provider string for which the address is being updated\\r\\n    /// @param providerAddress The new address of the provider\\r\\n    function updateProviderAddressOnTerms(\\r\\n        uint termId,\\r\\n        string memory providerString,\\r\\n        address providerAddress\\r\\n    ) external onlyOwner {\\r\\n        LibYieldGenerationStorage.YieldGeneration storage yield = LibYieldGenerationStorage\\r\\n            ._yieldStorage()\\r\\n            .yields[termId];\\r\\n\\r\\n        require(LibFundStorage._fundExists(termId), \\\"Fund does not exist\\\");\\r\\n        require(providerAddress != address(0), \\\"Invalid provider address\\\");\\r\\n        require(\\r\\n            yield.providerAddresses[providerString] != providerAddress,\\r\\n            \\\"Same provider address\\\"\\r\\n        );\\r\\n\\r\\n        yield.providerAddresses[providerString] = providerAddress;\\r\\n    }\\r\\n\\r\\n    /// @notice To be used in case of emergency, when yield got stuck in the vault\\r\\n    /// @notice The position of each array is used as a set in the calculation\\r\\n    /// @param termIds The term ids for which the yield is being rescued\\r\\n    /// @param originalWithdrawals The original ETH withdrawal amounts of each bad transaction\\r\\n    /// @param originalShares The original calculated shares amounts of each bad transaction\\r\\n    /// @param users The users to be reimbursed\\r\\n    function rescueStuckYields(\\r\\n        uint[] memory termIds,\\r\\n        uint[] memory originalWithdrawals,\\r\\n        uint[] memory originalShares,\\r\\n        address[] memory users\\r\\n    ) external payable {\\r\\n        // Start with validating the lengths of the arrays\\r\\n        uint length = termIds.length;\\r\\n        require(\\r\\n            length == originalWithdrawals.length &&\\r\\n                length == originalShares.length &&\\r\\n                length == users.length,\\r\\n            \\\"Arrays don't match\\\"\\r\\n        );\\r\\n\\r\\n        uint usedValue = 0; // Used to keep track of the lost ETH stored back into zaynfi\\r\\n\\r\\n        // Start looping through each combination\\r\\n        for (uint i; i < length; ) {\\r\\n            uint termId = termIds[i];\\r\\n            address user = users[i];\\r\\n\\r\\n            LibYieldGenerationStorage.YieldGeneration storage yield = LibYieldGenerationStorage\\r\\n                ._yieldStorage()\\r\\n                .yields[termId];\\r\\n\\r\\n            // Make sure user is part of this term and has enabled yield generation\\r\\n            require(yield.hasOptedIn[user], \\\"User not part of yield generation\\\");\\r\\n\\r\\n            // Zaynfi's addresses\\r\\n            address vaultAddress = yield.providerAddresses[\\\"ZaynVault\\\"];\\r\\n            address zapAddress = yield.providerAddresses[\\\"ZaynZap\\\"];\\r\\n\\r\\n            // Calculate what each user is owed\\r\\n            int reimbursement = _calculateReimbursement(\\r\\n                originalWithdrawals[i],\\r\\n                originalShares[i],\\r\\n                yield\\r\\n            );\\r\\n\\r\\n            if (reimbursement > 0) {\\r\\n                // Reimbursement is positive, this means the user withdrew less shares than he was supposed to\\r\\n                uint neededShares = uint(reimbursement);\\r\\n\\r\\n                // Code copied from _withdrawYG, get the amount of shares back and give it to the user\\r\\n                uint withdrawnYield = IZaynZapV2TakaDAO(zapAddress).zapOutETH(\\r\\n                    vaultAddress,\\r\\n                    neededShares,\\r\\n                    termId\\r\\n                );\\r\\n\\r\\n                yield.withdrawnYield[user] += withdrawnYield;\\r\\n                yield.availableYield[user] += withdrawnYield;\\r\\n\\r\\n                // Claim the yield right away and send it to the user\\r\\n                LibYieldGeneration._claimAvailableYield(termId, user, user);\\r\\n\\r\\n                emit OnYieldReimbursed(termId, user, withdrawnYield);\\r\\n            } else if (reimbursement < 0) {\\r\\n                // When there is a negative reimbursement, we compensate the pool by adding back the exact amount of shares that were lost\\r\\n                uint neededShares = uint(reimbursement * -1);\\r\\n\\r\\n                // Calculate the amount of eth we need to deposit to get the desired shares\\r\\n                uint pricePerShare = IZaynVaultV2TakaDao(vaultAddress).getPricePerFullShare();\\r\\n\\r\\n                uint neededEth = (15 * neededShares * pricePerShare) / 10 ** 19; // We ask for 150% of the shares we need to compensate for the slippage\\r\\n                uint sharesBefore = IZaynVaultV2TakaDao(vaultAddress).balanceOf(termId);\\r\\n\\r\\n                // Make sure we have enough eth\\r\\n                require(neededEth + usedValue <= msg.value, \\\"Not enough ETH value sent\\\");\\r\\n\\r\\n                // Deposit the amount of shares we lost\\r\\n                IZaynZapV2TakaDAO(zapAddress).zapInEth{value: neededEth}(vaultAddress, termId);\\r\\n\\r\\n                // Increment the used value so far\\r\\n                usedValue += neededEth;\\r\\n\\r\\n                // Validate the amount of shares deposited\\r\\n                uint sharesAfter = IZaynVaultV2TakaDao(vaultAddress).balanceOf(termId);\\r\\n\\r\\n                // If we deposited more shares than we needed, we withdraw the extra shares and send them back to the caller\\r\\n                uint withdrawnExtraEth = IZaynZapV2TakaDAO(zapAddress).zapOutETH(\\r\\n                    vaultAddress,\\r\\n                    sharesAfter - sharesBefore - neededShares,\\r\\n                    termId\\r\\n                );\\r\\n\\r\\n                uint sharesFinal = IZaynVaultV2TakaDao(vaultAddress).balanceOf(termId);\\r\\n                require(\\r\\n                    neededShares == (sharesFinal - sharesBefore),\\r\\n                    \\\"Final share balance incorrect\\\"\\r\\n                );\\r\\n\\r\\n                // Give the extra eth back to msg.sender\\r\\n                usedValue -= withdrawnExtraEth;\\r\\n\\r\\n                emit OnYieldCompensated(termId, user, (neededEth - withdrawnExtraEth));\\r\\n            }\\r\\n\\r\\n            unchecked {\\r\\n                ++i;\\r\\n            }\\r\\n        }\\r\\n\\r\\n        // Reimburse the leftover eth that the msg.sender sent\\r\\n        if (usedValue < msg.value) {\\r\\n            (bool success, ) = payable(msg.sender).call{value: msg.value - usedValue}(\\\"\\\");\\r\\n            require(success, \\\"Failed to send leftover ETH back\\\");\\r\\n        }\\r\\n    }\\r\\n\\r\\n    /// @notice To be used in case of emergency, when there are more shares deposited than expected\\r\\n    /// @param termIds The term ids for which the yield balance is to be restored\\r\\n    function reimburseExtraYield(uint[] memory termIds) external onlyOwner {\\r\\n        for (uint i; i < termIds.length; ) {\\r\\n            uint termId = termIds[i];\\r\\n            LibYieldGenerationStorage.YieldGeneration storage yield = LibYieldGenerationStorage\\r\\n                ._yieldStorage()\\r\\n                .yields[termId];\\r\\n\\r\\n            if (!yield.initialized) {\\r\\n                unchecked {\\r\\n                    ++i;\\r\\n                }\\r\\n                continue;\\r\\n            }\\r\\n\\r\\n            // Zaynfi's addresses\\r\\n            address vaultAddress = yield.providerAddresses[\\\"ZaynVault\\\"];\\r\\n            address zapAddress = yield.providerAddresses[\\\"ZaynZap\\\"];\\r\\n\\r\\n            uint neededShares = (yield.currentTotalDeposit * yield.totalShares) /\\r\\n                yield.totalDeposit;\\r\\n            uint actualShares = IZaynVaultV2TakaDao(vaultAddress).balanceOf(termId);\\r\\n\\r\\n            if (!(actualShares > neededShares)) {\\r\\n                unchecked {\\r\\n                    ++i;\\r\\n                }\\r\\n                continue;\\r\\n            }\\r\\n\\r\\n            address[] memory users = yield.yieldUsers;\\r\\n            uint reimbursed;\\r\\n            for (uint j; j < users.length; ) {\\r\\n                address user = users[j];\\r\\n                uint toWithdraw;\\r\\n                // Prevent rounding errors and make sure everything is withdrawn. This is done at the last user.\\r\\n                if (j + 1 == users.length) {\\r\\n                    toWithdraw = actualShares - neededShares - reimbursed;\\r\\n                } else {\\r\\n                    // Distribute the extra shares based on the yield distribution ratio\\r\\n                    toWithdraw =\\r\\n                        ((actualShares - neededShares) * yield.depositedCollateralByUser[user]) /\\r\\n                        yield.totalDeposit;\\r\\n                    reimbursed += toWithdraw;\\r\\n                }\\r\\n\\r\\n                // ZapOut the user's portion\\r\\n                uint withdrawnYield = IZaynZapV2TakaDAO(zapAddress).zapOutETH(\\r\\n                    vaultAddress,\\r\\n                    toWithdraw,\\r\\n                    termId\\r\\n                );\\r\\n\\r\\n                yield.withdrawnYield[user] += withdrawnYield;\\r\\n                yield.availableYield[user] += withdrawnYield;\\r\\n\\r\\n                // Claim the yield right away and send it to the user\\r\\n                LibYieldGeneration._claimAvailableYield(termId, user, user);\\r\\n\\r\\n                emit OnYieldCompensated(termId, user, withdrawnYield);\\r\\n\\r\\n                unchecked {\\r\\n                    ++j;\\r\\n                }\\r\\n            }\\r\\n\\r\\n            unchecked {\\r\\n                ++i;\\r\\n            }\\r\\n        }\\r\\n    }\\r\\n\\r\\n    /// @notice To be used in case of emergency, when the user has withdrawn too much eth from yield into the smart contract\\r\\n    /// @param termIds The term ids for which the yield balance is to be restored\\r\\n    function restoreYieldBalance(uint[] memory termIds) external payable onlyOwner {\\r\\n        uint usedValue = 0; // Used to keep track of the lost ETH stored back into zaynfi\\r\\n        // Start looping through each term id\\r\\n        for (uint i; i < termIds.length; ) {\\r\\n            uint termId = termIds[i];\\r\\n            LibYieldGenerationStorage.YieldGeneration storage yield = LibYieldGenerationStorage\\r\\n                ._yieldStorage()\\r\\n                .yields[termId];\\r\\n\\r\\n            if (!yield.initialized) {\\r\\n                unchecked {\\r\\n                    ++i;\\r\\n                }\\r\\n                continue;\\r\\n            }\\r\\n\\r\\n            // Zaynfi's addresses\\r\\n            address vaultAddress = yield.providerAddresses[\\\"ZaynVault\\\"];\\r\\n            address zapAddress = yield.providerAddresses[\\\"ZaynZap\\\"];\\r\\n\\r\\n            // Validate currentTotalDeposit to match the expected shares\\r\\n            uint neededShares = (yield.currentTotalDeposit * yield.totalShares) /\\r\\n                yield.totalDeposit;\\r\\n\\r\\n            require(\\r\\n                neededShares == IZaynVaultV2TakaDao(vaultAddress).balanceOf(termId),\\r\\n                \\\"currentTotalDeposit does not match needed shares!\\\"\\r\\n            );\\r\\n\\r\\n            // Deal with the case where the user has withdrawn too much eth from yield\\r\\n            // The user did not actually withdraw more ETH to his wallet, just that it was withdrawn back to the smart contract\\r\\n            // So no ETH was lost\\r\\n            address[] memory users = yield.yieldUsers;\\r\\n            uint withdrawnTooMuch;\\r\\n\\r\\n            for (uint j; j < users.length; ) {\\r\\n                address user = users[j];\\r\\n                uint withdraw = yield.withdrawnCollateral[user];\\r\\n                uint deposit = yield.depositedCollateralByUser[user];\\r\\n\\r\\n                if (withdraw > deposit) {\\r\\n                    withdrawnTooMuch += (withdraw - deposit);\\r\\n\\r\\n                    // Restore the withdrawnCollateral amount of the user to what it's supposed to be\\r\\n                    yield.withdrawnCollateral[user] = deposit;\\r\\n\\r\\n                    emit OnWithdrawnBalanceRestored(termId, user, deposit);\\r\\n                }\\r\\n\\r\\n                unchecked {\\r\\n                    ++j;\\r\\n                }\\r\\n            }\\r\\n\\r\\n            // Safety check but most likely the case\\r\\n            if (withdrawnTooMuch == 0) {\\r\\n                unchecked {\\r\\n                    ++i;\\r\\n                }\\r\\n                continue;\\r\\n            }\\r\\n\\r\\n            // Restore currentTotalDeposit to what it's supposed to be\\r\\n            yield.currentTotalDeposit += withdrawnTooMuch;\\r\\n\\r\\n            // We calculate the current shares we actually need in total for this term\\r\\n            neededShares = (yield.currentTotalDeposit * yield.totalShares) / yield.totalDeposit;\\r\\n\\r\\n            // withdrawnTooMuch was withdrawn back to the smart contract, we must send it back to the yield vault\\r\\n            IZaynZapV2TakaDAO(zapAddress).zapInEth{value: withdrawnTooMuch}(vaultAddress, termId);\\r\\n\\r\\n            // Get the shares after\\r\\n            uint sharesBalance = IZaynVaultV2TakaDao(vaultAddress).balanceOf(termId);\\r\\n            if (neededShares > sharesBalance) {\\r\\n                // If we still need more shares (which is most likely the case), we compensate by putting the missing amount into the vault\\r\\n                // Calculate the amount of eth we need to deposit to get the desired shares\\r\\n                uint pricePerShare = IZaynVaultV2TakaDao(vaultAddress).getPricePerFullShare();\\r\\n\\r\\n                uint neededEth = (15 * (neededShares - sharesBalance) * pricePerShare) / 10 ** 19; // We ask for 150% of the shares we need to compensate for the slippage\\r\\n\\r\\n                // Make sure we have enough eth\\r\\n                require(neededEth + usedValue <= msg.value, \\\"Not enough ETH value sent\\\");\\r\\n\\r\\n                // Deposit the amount of shares we lost\\r\\n                IZaynZapV2TakaDAO(zapAddress).zapInEth{value: neededEth}(vaultAddress, termId);\\r\\n\\r\\n                // Increment the used value so far\\r\\n                usedValue += neededEth;\\r\\n\\r\\n                // Validate the amount of shares deposited\\r\\n                sharesBalance = IZaynVaultV2TakaDao(vaultAddress).balanceOf(termId);\\r\\n\\r\\n                // If we deposited more shares than we needed, we withdraw the extra shares and send them back to the caller\\r\\n                uint withdrawnExtraEth = IZaynZapV2TakaDAO(zapAddress).zapOutETH(\\r\\n                    vaultAddress,\\r\\n                    sharesBalance - neededShares,\\r\\n                    termId\\r\\n                );\\r\\n\\r\\n                require(\\r\\n                    neededShares == IZaynVaultV2TakaDao(vaultAddress).balanceOf(termId),\\r\\n                    \\\"Final share balance incorrect\\\"\\r\\n                );\\r\\n\\r\\n                // Give the extra eth back to msg.sender\\r\\n                usedValue -= withdrawnExtraEth;\\r\\n\\r\\n                emit OnYieldTermUpdated(termId, withdrawnTooMuch, (neededEth - withdrawnExtraEth));\\r\\n            } else if (sharesBalance > neededShares) {\\r\\n                // If we deposited more shares than we needed, we withdraw the extra shares and send them back to the caller\\r\\n                IZaynZapV2TakaDAO(zapAddress).zapOutETH(\\r\\n                    vaultAddress,\\r\\n                    sharesBalance - neededShares,\\r\\n                    termId\\r\\n                );\\r\\n\\r\\n                emit OnYieldTermUpdated(termId, withdrawnTooMuch, 0);\\r\\n            }\\r\\n\\r\\n            // Some sanity checks\\r\\n            uint currentTotalDeposit;\\r\\n            for (uint j; j < users.length; ) {\\r\\n                address user = users[j];\\r\\n                uint withdraw = yield.withdrawnCollateral[user];\\r\\n                uint deposit = yield.depositedCollateralByUser[user];\\r\\n                require(deposit >= withdraw, \\\"Withdraw greater than deposit\\\");\\r\\n\\r\\n                currentTotalDeposit +=\\r\\n                    yield.depositedCollateralByUser[user] -\\r\\n                    yield.withdrawnCollateral[user];\\r\\n\\r\\n                unchecked {\\r\\n                    ++j;\\r\\n                }\\r\\n            }\\r\\n\\r\\n            require(\\r\\n                yield.currentTotalDeposit == currentTotalDeposit,\\r\\n                \\\"currentTotalDeposit invalid\\\"\\r\\n            );\\r\\n\\r\\n            uint currentShares = (currentTotalDeposit * yield.totalShares) / yield.totalDeposit;\\r\\n\\r\\n            require(\\r\\n                currentShares == IZaynVaultV2TakaDao(vaultAddress).balanceOf(termId),\\r\\n                \\\"Shares invalid\\\"\\r\\n            );\\r\\n\\r\\n            unchecked {\\r\\n                ++i;\\r\\n            }\\r\\n        }\\r\\n\\r\\n        // Reimburse the leftover eth that the msg.sender sent\\r\\n        if (usedValue < msg.value) {\\r\\n            (bool success, ) = payable(msg.sender).call{value: msg.value - usedValue}(\\\"\\\");\\r\\n            require(success, \\\"Failed to send leftover ETH back\\\");\\r\\n        }\\r\\n    }\\r\\n\\r\\n    /// @notice To be used in case of emergency, when yield got stuck in the vault\\r\\n    /// @notice The position of each array is used as a set in the calculation\\r\\n    /// @param originalWithdrawal The original ETH withdrawal amount\\r\\n    /// @param originalShares The original calculated shares amount\\r\\n    /// @param yield the reference to the yield\\r\\n    function _calculateReimbursement(\\r\\n        uint originalWithdrawal,\\r\\n        uint originalShares,\\r\\n        LibYieldGenerationStorage.YieldGeneration storage yield\\r\\n    ) internal view returns (int) {\\r\\n        uint correctedShares = (originalWithdrawal * yield.totalShares) / yield.totalDeposit;\\r\\n\\r\\n        if (correctedShares > originalShares) {\\r\\n            return int(correctedShares - originalShares);\\r\\n        } else if (correctedShares < originalShares) {\\r\\n            return int(originalShares - correctedShares) * -1;\\r\\n        }\\r\\n\\r\\n        return 0;\\r\\n    }\\r\\n}\\r\\n\",\"keccak256\":\"0xe9207a75d285db86ea776b69a4f35d774d6efc3bab20be198e40a6df9b82f3fd\",\"license\":\"GPL-3.0\"},\"contracts/interfaces/IYGFacetZaynFi.sol\":{\"content\":\"// SPDX-License-Identifier: GPL-3.0\\r\\n\\r\\npragma solidity 0.8.18;\\r\\n\\r\\nimport {LibTermStorage} from \\\"../libraries/LibTermStorage.sol\\\";\\r\\n\\r\\ninterface IYGFacetZaynFi {\\r\\n    /// @notice This function allows a user to claim the current available yield\\r\\n    /// @param termId The term id for which the yield is being claimed\\r\\n    /// @param receiver The address of the user who will receive the yield\\r\\n    function claimAvailableYield(uint termId, address receiver) external;\\r\\n\\r\\n    /// @notice This function allows a user to toggle their yield generation\\r\\n    /// @dev only allowed before the term starts\\r\\n    /// @param termId The term id for which the yield is being claimed\\r\\n    function toggleOptInYG(uint termId) external;\\r\\n\\r\\n    /// @notice This function allows the owner to update the global variable for new yield provider\\r\\n    /// @param providerString The provider string for which the address is being updated\\r\\n    /// @param providerAddress The new address of the provider\\r\\n    function updateYieldProvider(string memory providerString, address providerAddress) external;\\r\\n\\r\\n    /// @notice This function allows the owner to disable the yield generation feature in case of emergency\\r\\n    function toggleYieldLock() external returns (bool);\\r\\n\\r\\n    /// @notice To be used in case of emergency, when the provider needs to change the zap or the vault\\r\\n    /// @param termId The term id for which the yield is being claimed\\r\\n    /// @param providerString The provider string for which the address is being updated\\r\\n    /// @param providerAddress The new address of the provider\\r\\n    function updateProviderAddressOnTerms(\\r\\n        uint termId,\\r\\n        string memory providerString,\\r\\n        address providerAddress\\r\\n    ) external;\\r\\n}\\r\\n\",\"keccak256\":\"0x5d55165eeec8910a05551e52ca1d4b9c4fec7fdb7f4858c7afef90f746cfde4f\",\"license\":\"GPL-3.0\"},\"contracts/interfaces/IZaynVaultV2TakaDao.sol\":{\"content\":\"// SPDX-License-Identifier: GPL-3.0\\r\\npragma solidity ^0.8.5;\\r\\n\\r\\ninterface IZaynVaultV2TakaDao {\\r\\n    function totalSupply() external view returns (uint256);\\r\\n\\r\\n    function depositZap(uint256 _amount, uint256 _term) external;\\r\\n\\r\\n    function withdrawZap(uint256 _shares, uint256 _term) external;\\r\\n\\r\\n    function want() external view returns (address);\\r\\n\\r\\n    function balance() external view returns (uint256);\\r\\n\\r\\n    function strategy() external view returns (address);\\r\\n\\r\\n    function balanceOf(uint256 term) external view returns (uint256);\\r\\n\\r\\n    function getPricePerFullShare() external view returns (uint256);\\r\\n}\\r\\n\",\"keccak256\":\"0x78699e5f3347a796b59482d2d5ad459c68125c87223e0d4634188f3e1339cf7f\",\"license\":\"GPL-3.0\"},\"contracts/interfaces/IZaynZapV2TakaDAO.sol\":{\"content\":\"// SPDX-License-Identifier: GPL-3.0\\r\\npragma solidity ^0.8.5;\\r\\n\\r\\ninterface IZaynZapV2TakaDAO {\\r\\n    function zapInEth(address vault, uint256 termID) external payable;\\r\\n\\r\\n    function zapOutETH(address vault, uint256 _shares, uint256 termID) external returns (uint);\\r\\n\\r\\n    function toggleTrustedSender(address _trustedSender, bool _allow) external;\\r\\n}\\r\\n\",\"keccak256\":\"0x0d0cdf796501fc604bc1c83c28ff89fefe49ea1b994677c60dc62312af143c94\",\"license\":\"GPL-3.0\"},\"contracts/libraries/LibCollateralStorage.sol\":{\"content\":\"// SPDX-License-Identifier: MIT\\r\\npragma solidity 0.8.18;\\r\\n\\r\\nlibrary LibCollateralStorage {\\r\\n    bytes32 constant COLLATERAL_STORAGE_POSITION = keccak256(\\\"diamond.standard.collateral.storage\\\");\\r\\n\\r\\n    enum CollateralStates {\\r\\n        AcceptingCollateral, // Initial state where collateral are deposited\\r\\n        CycleOngoing, // Triggered when a fund instance is created, no collateral can be accepted\\r\\n        ReleasingCollateral, // Triggered when the fund closes\\r\\n        Closed // Triggered when all depositors withdraw their collaterals\\r\\n    }\\r\\n\\r\\n    struct DefaulterState {\\r\\n        bool payWithCollateral;\\r\\n        bool payWithFrozenPool;\\r\\n        bool gettingExpelled;\\r\\n        bool isBeneficiary;\\r\\n    }\\r\\n\\r\\n    struct Collateral {\\r\\n        bool initialized;\\r\\n        CollateralStates state;\\r\\n        uint firstDepositTime;\\r\\n        uint counterMembers;\\r\\n        address[] depositors;\\r\\n        mapping(address => bool) isCollateralMember; // Determines if a depositor is a valid user\\r\\n        mapping(address => uint) collateralMembersBank; // Users main balance\\r\\n        mapping(address => uint) collateralPaymentBank; // Users reimbursement balance after someone defaults\\r\\n        mapping(address => uint) collateralDepositByUser; // Depends on the depositors index\\r\\n    }\\r\\n\\r\\n    struct CollateralStorage {\\r\\n        mapping(uint => Collateral) collaterals; // termId => Collateral struct\\r\\n    }\\r\\n\\r\\n    function _collateralExists(uint termId) internal view returns (bool) {\\r\\n        return _collateralStorage().collaterals[termId].initialized;\\r\\n    }\\r\\n\\r\\n    function _collateralStorage()\\r\\n        internal\\r\\n        pure\\r\\n        returns (CollateralStorage storage collateralStorage)\\r\\n    {\\r\\n        bytes32 position = COLLATERAL_STORAGE_POSITION;\\r\\n        assembly {\\r\\n            collateralStorage.slot := position\\r\\n        }\\r\\n    }\\r\\n}\\r\\n\",\"keccak256\":\"0xd4f3ddd4b3ea2531cb93494be6ee8433464221d6f0563eecabbf0d8d0c03ed01\",\"license\":\"MIT\"},\"contracts/libraries/LibFundStorage.sol\":{\"content\":\"// SPDX-License-Identifier: MIT\\r\\npragma solidity 0.8.18;\\r\\n\\r\\nimport {IERC20} from \\\"@openzeppelin/contracts/token/ERC20/IERC20.sol\\\";\\r\\n\\r\\nimport {EnumerableSet} from \\\"@openzeppelin/contracts/utils/structs/EnumerableSet.sol\\\";\\r\\n\\r\\nlibrary LibFundStorage {\\r\\n    using EnumerableSet for EnumerableSet.AddressSet;\\r\\n\\r\\n    bytes32 constant FUND_POSITION = keccak256(\\\"diamond.standard.fund\\\");\\r\\n    bytes32 constant FUND_STORAGE_POSITION = keccak256(\\\"diamond.standard.fund.storage\\\");\\r\\n\\r\\n    enum FundStates {\\r\\n        InitializingFund, // Time before the first cycle has started\\r\\n        AcceptingContributions, // Triggers at the start of a cycle\\r\\n        AwardingBeneficiary, // Contributions are closed, beneficiary is chosen, people default etc.\\r\\n        CycleOngoing, // Time after beneficiary is chosen, up till the start of the next cycle\\r\\n        FundClosed // Triggers at the end of the last contribution period, no state changes after this\\r\\n    }\\r\\n\\r\\n    struct PayExemption {\\r\\n        mapping(address => bool) exempted; // Mapping to keep track of if someone is exempted from paying\\r\\n    }\\r\\n\\r\\n    struct Fund {\\r\\n        bool initialized;\\r\\n        FundStates currentState; // Variable to keep track of the different FundStates\\r\\n        IERC20 stableToken; // Instance of the stable token\\r\\n        address[] beneficiariesOrder; // The correct order of who gets to be next beneficiary, determined by collateral contract\\r\\n        uint fundStart; // Timestamp of the start of the fund\\r\\n        uint fundEnd; // Timestamp of the end of the fund\\r\\n        uint currentCycle; // Index of current cycle\\r\\n        mapping(address => bool) isParticipant; // Mapping to keep track of who's a participant or not\\r\\n        mapping(address => bool) isBeneficiary; // Mapping to keep track of who's a beneficiary or not\\r\\n        mapping(address => bool) paidThisCycle; // Mapping to keep track of who paid for this cycle\\r\\n        mapping(address => bool) autoPayEnabled; // Wheter to attempt to automate payments at the end of the contribution period\\r\\n        mapping(address => uint) beneficiariesPool; // Mapping to keep track on how much each beneficiary can claim. Six decimals\\r\\n        mapping(address => bool) beneficiariesFrozenPool; // Frozen pool by beneficiaries, it can claim when his collateral is at least 1.1 X RCC\\r\\n        mapping(address => uint) cycleOfExpulsion; // Mapping to keep track on which cycle a user was expelled\\r\\n        mapping(uint => PayExemption) isExemptedOnCycle; // Mapping to keep track of if someone is exempted from paying this cycle\\r\\n        EnumerableSet.AddressSet _participants; // Those who have not been beneficiaries yet and have not defaulted this cycle\\r\\n        EnumerableSet.AddressSet _beneficiaries; // Those who have been beneficiaries and have not defaulted this cycle\\r\\n        EnumerableSet.AddressSet _defaulters; // Both participants and beneficiaries who have defaulted this cycle\\r\\n        uint expelledParticipants; // Total amount of participants that have been expelled so far\\r\\n        uint totalAmountOfCycles;\\r\\n        mapping(address => bool) expelledBeforeBeneficiary; // Mapping to keep track of who has been expelled before being a beneficiary\\r\\n    }\\r\\n\\r\\n    struct FundStorage {\\r\\n        mapping(uint => Fund) funds; // termId => Fund struct\\r\\n    }\\r\\n\\r\\n    function _fundExists(uint termId) internal view returns (bool) {\\r\\n        return _fundStorage().funds[termId].initialized;\\r\\n    }\\r\\n\\r\\n    function _fundStorage() internal pure returns (FundStorage storage fundStorage) {\\r\\n        bytes32 position = FUND_STORAGE_POSITION;\\r\\n        assembly {\\r\\n            fundStorage.slot := position\\r\\n        }\\r\\n    }\\r\\n}\\r\\n\",\"keccak256\":\"0xa92b912c45c29b3022b2a98c0606f1d9cd6d9305576c3195bd6a226ece6966f6\",\"license\":\"MIT\"},\"contracts/libraries/LibTermStorage.sol\":{\"content\":\"// SPDX-License-Identifier: MIT\\r\\npragma solidity 0.8.18;\\r\\n\\r\\nlibrary LibTermStorage {\\r\\n    bytes32 constant TERM_CONSTS_POSITION = keccak256(\\\"diamond.standard.term.consts\\\");\\r\\n    bytes32 constant TERM_STORAGE_POSITION = keccak256(\\\"diamond.standard.term.storage\\\");\\r\\n\\r\\n    enum TermStates {\\r\\n        InitializingTerm,\\r\\n        ActiveTerm,\\r\\n        ExpiredTerm,\\r\\n        ClosedTerm\\r\\n    }\\r\\n\\r\\n    struct TermConsts {\\r\\n        mapping(string => address) aggregatorsAddresses; // \\\"ETH/USD\\\" => address , \\\"USDC/USD\\\" => address\\r\\n    }\\r\\n\\r\\n    struct Term {\\r\\n        bool initialized;\\r\\n        TermStates state;\\r\\n        address termOwner;\\r\\n        uint creationTime;\\r\\n        uint termId;\\r\\n        uint registrationPeriod; // Time for registration (seconds)\\r\\n        uint totalParticipants; // Max number of participants\\r\\n        uint cycleTime; // Time for single cycle (seconds)\\r\\n        uint contributionAmount; // Amount user must pay per cycle (USD)\\r\\n        uint contributionPeriod; // The portion of cycle user must make payment\\r\\n        address stableTokenAddress;\\r\\n    }\\r\\n\\r\\n    struct TermStorage {\\r\\n        uint nextTermId;\\r\\n        mapping(uint => Term) terms; // termId => Term struct\\r\\n        mapping(address => uint[]) participantToTermId; // userAddress => [termId1, termId2, ...]\\r\\n    }\\r\\n\\r\\n    function _termExists(uint termId) internal view returns (bool) {\\r\\n        return _termStorage().terms[termId].initialized;\\r\\n    }\\r\\n\\r\\n    function _termConsts() internal pure returns (TermConsts storage termConsts) {\\r\\n        bytes32 position = TERM_CONSTS_POSITION;\\r\\n        assembly {\\r\\n            termConsts.slot := position\\r\\n        }\\r\\n    }\\r\\n\\r\\n    function _termStorage() internal pure returns (TermStorage storage termStorage) {\\r\\n        bytes32 position = TERM_STORAGE_POSITION;\\r\\n        assembly {\\r\\n            termStorage.slot := position\\r\\n        }\\r\\n    }\\r\\n}\\r\\n\",\"keccak256\":\"0x8d12e51a175c821d32aa12da41bf3158a8aa1ec0a377232800cd6cfd21e81a2b\",\"license\":\"MIT\"},\"contracts/libraries/LibYieldGeneration.sol\":{\"content\":\"// SPDX-License-Identifier: MIT\\r\\npragma solidity 0.8.18;\\r\\n\\r\\nimport {IZaynZapV2TakaDAO} from \\\"../interfaces/IZaynZapV2TakaDAO.sol\\\";\\r\\nimport {IZaynVaultV2TakaDao} from \\\"../interfaces/IZaynVaultV2TakaDao.sol\\\";\\r\\n\\r\\nimport {LibYieldGenerationStorage} from \\\"../libraries/LibYieldGenerationStorage.sol\\\";\\r\\n\\r\\nlibrary LibYieldGeneration {\\r\\n    event OnYieldClaimed(\\r\\n        uint indexed termId,\\r\\n        address indexed user,\\r\\n        address receiver,\\r\\n        uint indexed amount\\r\\n    ); // Emits when a user claims their yield\\r\\n\\r\\n    /// @notice This function is used to deposit collateral for yield generation\\r\\n    /// @param _termId The term id for which the collateral is being deposited\\r\\n    /// @param _ethAmount The amount of collateral being deposited\\r\\n    function _depositYG(uint _termId, uint _ethAmount) internal {\\r\\n        LibYieldGenerationStorage.YieldGeneration storage yield = LibYieldGenerationStorage\\r\\n            ._yieldStorage()\\r\\n            .yields[_termId];\\r\\n\\r\\n        yield.totalDeposit = _ethAmount;\\r\\n        yield.currentTotalDeposit = _ethAmount;\\r\\n\\r\\n        address vaultAddress = yield.providerAddresses[\\\"ZaynVault\\\"];\\r\\n\\r\\n        IZaynZapV2TakaDAO(yield.providerAddresses[\\\"ZaynZap\\\"]).zapInEth{value: _ethAmount}(\\r\\n            vaultAddress,\\r\\n            _termId\\r\\n        );\\r\\n\\r\\n        yield.totalShares = IZaynVaultV2TakaDao(vaultAddress).balanceOf(_termId);\\r\\n    }\\r\\n\\r\\n    /// @notice This function is used to withdraw collateral from the yield generation protocol\\r\\n    /// @param _termId The term id for which the collateral is being withdrawn\\r\\n    /// @param _collateralAmount The amount of collateral being withdrawn\\r\\n    /// @param _user The user address that is withdrawing the collateral\\r\\n    function _withdrawYG(\\r\\n        uint _termId,\\r\\n        uint256 _collateralAmount,\\r\\n        address _user\\r\\n    ) internal returns (uint) {\\r\\n        LibYieldGenerationStorage.YieldGeneration storage yield = LibYieldGenerationStorage\\r\\n            ._yieldStorage()\\r\\n            .yields[_termId];\\r\\n\\r\\n        uint neededShares = _neededShares(_collateralAmount, yield.totalShares, yield.totalDeposit);\\r\\n\\r\\n        yield.withdrawnCollateral[_user] += _collateralAmount;\\r\\n        yield.currentTotalDeposit -= _collateralAmount;\\r\\n\\r\\n        address zapAddress = yield.providerAddresses[\\\"ZaynZap\\\"];\\r\\n        address vaultAddress = yield.providerAddresses[\\\"ZaynVault\\\"];\\r\\n\\r\\n        uint withdrawnAmount = IZaynZapV2TakaDAO(zapAddress).zapOutETH(\\r\\n            vaultAddress,\\r\\n            neededShares,\\r\\n            _termId\\r\\n        );\\r\\n\\r\\n        if (withdrawnAmount < _collateralAmount) {\\r\\n            return 0;\\r\\n        } else {\\r\\n            uint withdrawnYield = withdrawnAmount - _collateralAmount;\\r\\n            yield.withdrawnYield[_user] += withdrawnYield;\\r\\n            yield.availableYield[_user] += withdrawnYield;\\r\\n\\r\\n            return withdrawnYield;\\r\\n        }\\r\\n    }\\r\\n\\r\\n    /// @notice Conversion from shares to eth\\r\\n    /// @param _termId The term id\\r\\n    /// @param _yield The yield generation struct\\r\\n    function _sharesToEth(\\r\\n        uint _termId,\\r\\n        LibYieldGenerationStorage.YieldGeneration storage _yield\\r\\n    ) internal view returns (uint) {\\r\\n        uint termBalance = IZaynVaultV2TakaDao(_yield.providerAddresses[\\\"ZaynVault\\\"]).balanceOf(\\r\\n            _termId\\r\\n        );\\r\\n\\r\\n        uint pricePerShare = IZaynVaultV2TakaDao(_yield.providerAddresses[\\\"ZaynVault\\\"])\\r\\n            .getPricePerFullShare();\\r\\n\\r\\n        return (termBalance * pricePerShare) / 10 ** 18;\\r\\n    }\\r\\n\\r\\n    /// @notice Conversion from eth to shares\\r\\n    /// @param _collateralAmount The amount of collateral to withdraw\\r\\n    /// @param _totalShares The total shares in the yield from the term\\r\\n    /// @param _totalDeposit The total deposit in the yield from the term\\r\\n    function _neededShares(\\r\\n        uint _collateralAmount,\\r\\n        uint _totalShares,\\r\\n        uint _totalDeposit\\r\\n    ) internal pure returns (uint) {\\r\\n        if (_totalDeposit == 0) return 0;\\r\\n        return ((_collateralAmount * _totalShares) / _totalDeposit);\\r\\n    }\\r\\n\\r\\n    /// @notice This function is used to get the current total yield generated for a term\\r\\n    /// @param _termId The term id for which the yield is being calculated\\r\\n    /// @return The total yield generated for the term\\r\\n    function _currentYieldGenerated(uint _termId) internal view returns (uint) {\\r\\n        LibYieldGenerationStorage.YieldGeneration storage yield = LibYieldGenerationStorage\\r\\n            ._yieldStorage()\\r\\n            .yields[_termId];\\r\\n\\r\\n        uint termBalance = IZaynVaultV2TakaDao(yield.providerAddresses[\\\"ZaynVault\\\"]).balanceOf(\\r\\n            _termId\\r\\n        );\\r\\n        uint pricePerShare = IZaynVaultV2TakaDao(yield.providerAddresses[\\\"ZaynVault\\\"])\\r\\n            .getPricePerFullShare();\\r\\n\\r\\n        uint sharesInEth = (termBalance * pricePerShare) / 10 ** 18;\\r\\n        if (sharesInEth > yield.currentTotalDeposit) {\\r\\n            return sharesInEth - yield.currentTotalDeposit;\\r\\n        } else {\\r\\n            return 0;\\r\\n        }\\r\\n    }\\r\\n\\r\\n    /// @notice This function is used to get the yield distribution ratio for a user\\r\\n    /// @param _termId The term id for which the ratio is being calculated\\r\\n    /// @param _user The user for which the ratio is being calculated\\r\\n    /// @return The yield distribution ratio for the user\\r\\n    function _yieldDistributionRatio(uint _termId, address _user) internal view returns (uint256) {\\r\\n        LibYieldGenerationStorage.YieldGeneration storage yield = LibYieldGenerationStorage\\r\\n            ._yieldStorage()\\r\\n            .yields[_termId];\\r\\n\\r\\n        if (yield.currentTotalDeposit == 0) {\\r\\n            return 0;\\r\\n        } else {\\r\\n            return\\r\\n                ((yield.depositedCollateralByUser[_user] - yield.withdrawnCollateral[_user]) *\\r\\n                    10 ** 18) / yield.totalDeposit;\\r\\n        }\\r\\n    }\\r\\n\\r\\n    /// @notice This function is used to get the total yield generated for a user\\r\\n    /// @param termId The term id for which the yield is being calculated\\r\\n    /// @param user The user for which the yield is being calculated\\r\\n    /// @return The total yield generated for the user\\r\\n    function _unwithdrawnUserYieldGenerated(\\r\\n        uint termId,\\r\\n        address user\\r\\n    ) internal view returns (uint) {\\r\\n        uint yieldDistributed = (_currentYieldGenerated(termId) *\\r\\n            _yieldDistributionRatio(termId, user)) / 10 ** 18;\\r\\n\\r\\n        return yieldDistributed;\\r\\n    }\\r\\n\\r\\n    function _claimAvailableYield(uint _termId, address _user, address _receiver) internal {\\r\\n        LibYieldGenerationStorage.YieldGeneration storage yield = LibYieldGenerationStorage\\r\\n            ._yieldStorage()\\r\\n            .yields[_termId];\\r\\n\\r\\n        uint availableYield = yield.availableYield[_user];\\r\\n\\r\\n        require(availableYield > 0, \\\"No yield to withdraw\\\");\\r\\n\\r\\n        yield.availableYield[_user] = 0;\\r\\n        (bool success, ) = payable(_receiver).call{value: availableYield}(\\\"\\\");\\r\\n        require(success);\\r\\n\\r\\n        emit OnYieldClaimed(_termId, _user, _receiver, availableYield);\\r\\n    }\\r\\n}\\r\\n\",\"keccak256\":\"0xbb3ee17c4468eaf841138fb9b58f0cbdd3d0ab7b98039526642744d45dee3bdd\",\"license\":\"MIT\"},\"contracts/libraries/LibYieldGenerationStorage.sol\":{\"content\":\"// SPDX-License-Identifier: MIT\\r\\npragma solidity 0.8.18;\\r\\n\\r\\nlibrary LibYieldGenerationStorage {\\r\\n    bytes32 constant YIELD_PROVIDERS_POSITION = keccak256(\\\"diamond.standard.yield.providers\\\");\\r\\n    bytes32 constant YIELD_STORAGE_POSITION = keccak256(\\\"diamond.standard.yield.storage\\\");\\r\\n    bytes32 constant YIELD_LOCK_POSITION = keccak256(\\\"diamond.standard.yield.lock\\\");\\r\\n\\r\\n    enum YGProviders {\\r\\n        InHouse,\\r\\n        ZaynFi\\r\\n    }\\r\\n\\r\\n    struct YieldLock {\\r\\n        bool yieldLock;\\r\\n    }\\r\\n\\r\\n    // Both index 0 are reserved for ZaynFi\\r\\n    struct YieldProviders {\\r\\n        mapping(string => address) providerAddresses;\\r\\n    }\\r\\n\\r\\n    struct YieldGeneration {\\r\\n        bool initialized;\\r\\n        YGProviders provider;\\r\\n        mapping(string => address) providerAddresses;\\r\\n        uint startTimeStamp;\\r\\n        uint totalDeposit;\\r\\n        uint currentTotalDeposit;\\r\\n        uint totalShares;\\r\\n        address[] yieldUsers;\\r\\n        mapping(address => bool) hasOptedIn;\\r\\n        mapping(address => uint256) withdrawnYield;\\r\\n        mapping(address => uint256) withdrawnCollateral;\\r\\n        mapping(address => uint256) availableYield;\\r\\n        mapping(address => uint256) depositedCollateralByUser;\\r\\n    }\\r\\n\\r\\n    struct YieldStorage {\\r\\n        mapping(uint => YieldGeneration) yields; // termId => YieldGeneration struct\\r\\n    }\\r\\n\\r\\n    function _yieldExists(uint termId) internal view returns (bool) {\\r\\n        return _yieldStorage().yields[termId].initialized;\\r\\n    }\\r\\n\\r\\n    function _yieldLock() internal pure returns (YieldLock storage yieldLock) {\\r\\n        bytes32 position = YIELD_LOCK_POSITION;\\r\\n        assembly {\\r\\n            yieldLock.slot := position\\r\\n        }\\r\\n    }\\r\\n\\r\\n    function _yieldProviders() internal pure returns (YieldProviders storage yieldProviders) {\\r\\n        bytes32 position = YIELD_PROVIDERS_POSITION;\\r\\n        assembly {\\r\\n            yieldProviders.slot := position\\r\\n        }\\r\\n    }\\r\\n\\r\\n    function _yieldStorage() internal pure returns (YieldStorage storage yieldStorage) {\\r\\n        bytes32 position = YIELD_STORAGE_POSITION;\\r\\n        assembly {\\r\\n            yieldStorage.slot := position\\r\\n        }\\r\\n    }\\r\\n}\\r\\n\",\"keccak256\":\"0xaeed5248c171a073c6cdf849d6bc3d840a5f9d5d6ef514b462c06f83c886a042\",\"license\":\"MIT\"},\"hardhat-deploy/solc_0.8/diamond/interfaces/IDiamondCut.sol\":{\"content\":\"// SPDX-License-Identifier: MIT\\npragma solidity ^0.8.0;\\n\\n/******************************************************************************\\\\\\n* Author: Nick Mudge <nick@perfectabstractions.com> (https://twitter.com/mudgen)\\n* EIP-2535 Diamonds: https://eips.ethereum.org/EIPS/eip-2535\\n/******************************************************************************/\\n\\ninterface IDiamondCut {\\n    enum FacetCutAction {Add, Replace, Remove}\\n    // Add=0, Replace=1, Remove=2\\n\\n    struct FacetCut {\\n        address facetAddress;\\n        FacetCutAction action;\\n        bytes4[] functionSelectors;\\n    }\\n\\n    /// @notice Add/replace/remove any number of functions and optionally execute\\n    ///         a function with delegatecall\\n    /// @param _diamondCut Contains the facet addresses and function selectors\\n    /// @param _init The address of the contract or facet to execute _calldata\\n    /// @param _calldata A function call, including function selector and arguments\\n    ///                  _calldata is executed with delegatecall on _init\\n    function diamondCut(\\n        FacetCut[] calldata _diamondCut,\\n        address _init,\\n        bytes calldata _calldata\\n    ) external;\\n\\n    event DiamondCut(FacetCut[] _diamondCut, address _init, bytes _calldata);\\n}\\n\",\"keccak256\":\"0xc00c16bfa30a3fa5f3dc684f7f8ba62c259962b25f647d9588739458989717fc\",\"license\":\"MIT\"},\"hardhat-deploy/solc_0.8/diamond/libraries/LibDiamond.sol\":{\"content\":\"// SPDX-License-Identifier: MIT\\npragma solidity ^0.8.0;\\n\\n/******************************************************************************\\\\\\n* Author: Nick Mudge <nick@perfectabstractions.com> (https://twitter.com/mudgen)\\n* EIP-2535 Diamonds: https://eips.ethereum.org/EIPS/eip-2535\\n/******************************************************************************/\\nimport { IDiamondCut } from \\\"../interfaces/IDiamondCut.sol\\\";\\n\\nlibrary LibDiamond {\\n    bytes32 constant DIAMOND_STORAGE_POSITION = keccak256(\\\"diamond.standard.diamond.storage\\\");\\n\\n    struct FacetAddressAndPosition {\\n        address facetAddress;\\n        uint96 functionSelectorPosition; // position in facetFunctionSelectors.functionSelectors array\\n    }\\n\\n    struct FacetFunctionSelectors {\\n        bytes4[] functionSelectors;\\n        uint256 facetAddressPosition; // position of facetAddress in facetAddresses array\\n    }\\n\\n    struct DiamondStorage {\\n        // maps function selector to the facet address and\\n        // the position of the selector in the facetFunctionSelectors.selectors array\\n        mapping(bytes4 => FacetAddressAndPosition) selectorToFacetAndPosition;\\n        // maps facet addresses to function selectors\\n        mapping(address => FacetFunctionSelectors) facetFunctionSelectors;\\n        // facet addresses\\n        address[] facetAddresses;\\n        // Used to query if a contract implements an interface.\\n        // Used to implement ERC-165.\\n        mapping(bytes4 => bool) supportedInterfaces;\\n        // owner of the contract\\n        address contractOwner;\\n    }\\n\\n    function diamondStorage() internal pure returns (DiamondStorage storage ds) {\\n        bytes32 position = DIAMOND_STORAGE_POSITION;\\n        assembly {\\n            ds.slot := position\\n        }\\n    }\\n\\n    event OwnershipTransferred(address indexed previousOwner, address indexed newOwner);\\n\\n    function setContractOwner(address _newOwner) internal {\\n        DiamondStorage storage ds = diamondStorage();\\n        address previousOwner = ds.contractOwner;\\n        ds.contractOwner = _newOwner;\\n        emit OwnershipTransferred(previousOwner, _newOwner);\\n    }\\n\\n    function contractOwner() internal view returns (address contractOwner_) {\\n        contractOwner_ = diamondStorage().contractOwner;\\n    }\\n\\n    function enforceIsContractOwner() internal view {\\n        require(msg.sender == diamondStorage().contractOwner, \\\"LibDiamond: Must be contract owner\\\");\\n    }\\n\\n    event DiamondCut(IDiamondCut.FacetCut[] _diamondCut, address _init, bytes _calldata);\\n\\n    // Internal function version of diamondCut\\n    function diamondCut(\\n        IDiamondCut.FacetCut[] memory _diamondCut,\\n        address _init,\\n        bytes memory _calldata\\n    ) internal {\\n        for (uint256 facetIndex; facetIndex < _diamondCut.length; facetIndex++) {\\n            IDiamondCut.FacetCutAction action = _diamondCut[facetIndex].action;\\n            if (action == IDiamondCut.FacetCutAction.Add) {\\n                addFunctions(_diamondCut[facetIndex].facetAddress, _diamondCut[facetIndex].functionSelectors);\\n            } else if (action == IDiamondCut.FacetCutAction.Replace) {\\n                replaceFunctions(_diamondCut[facetIndex].facetAddress, _diamondCut[facetIndex].functionSelectors);\\n            } else if (action == IDiamondCut.FacetCutAction.Remove) {\\n                removeFunctions(_diamondCut[facetIndex].facetAddress, _diamondCut[facetIndex].functionSelectors);\\n            } else {\\n                revert(\\\"LibDiamondCut: Incorrect FacetCutAction\\\");\\n            }\\n        }\\n        emit DiamondCut(_diamondCut, _init, _calldata);\\n        initializeDiamondCut(_init, _calldata);\\n    }\\n\\n    function addFunctions(address _facetAddress, bytes4[] memory _functionSelectors) internal {\\n        require(_functionSelectors.length > 0, \\\"LibDiamondCut: No selectors in facet to cut\\\");\\n        DiamondStorage storage ds = diamondStorage();        \\n        require(_facetAddress != address(0), \\\"LibDiamondCut: Add facet can't be address(0)\\\");\\n        uint96 selectorPosition = uint96(ds.facetFunctionSelectors[_facetAddress].functionSelectors.length);\\n        // add new facet address if it does not exist\\n        if (selectorPosition == 0) {\\n            addFacet(ds, _facetAddress);            \\n        }\\n        for (uint256 selectorIndex; selectorIndex < _functionSelectors.length; selectorIndex++) {\\n            bytes4 selector = _functionSelectors[selectorIndex];\\n            address oldFacetAddress = ds.selectorToFacetAndPosition[selector].facetAddress;\\n            require(oldFacetAddress == address(0), \\\"LibDiamondCut: Can't add function that already exists\\\");\\n            addFunction(ds, selector, selectorPosition, _facetAddress);\\n            selectorPosition++;\\n        }\\n    }\\n\\n    function replaceFunctions(address _facetAddress, bytes4[] memory _functionSelectors) internal {\\n        require(_functionSelectors.length > 0, \\\"LibDiamondCut: No selectors in facet to cut\\\");\\n        DiamondStorage storage ds = diamondStorage();\\n        require(_facetAddress != address(0), \\\"LibDiamondCut: Add facet can't be address(0)\\\");\\n        uint96 selectorPosition = uint96(ds.facetFunctionSelectors[_facetAddress].functionSelectors.length);\\n        // add new facet address if it does not exist\\n        if (selectorPosition == 0) {\\n            addFacet(ds, _facetAddress);\\n        }\\n        for (uint256 selectorIndex; selectorIndex < _functionSelectors.length; selectorIndex++) {\\n            bytes4 selector = _functionSelectors[selectorIndex];\\n            address oldFacetAddress = ds.selectorToFacetAndPosition[selector].facetAddress;\\n            require(oldFacetAddress != _facetAddress, \\\"LibDiamondCut: Can't replace function with same function\\\");\\n            removeFunction(ds, oldFacetAddress, selector);\\n            addFunction(ds, selector, selectorPosition, _facetAddress);\\n            selectorPosition++;\\n        }\\n    }\\n\\n    function removeFunctions(address _facetAddress, bytes4[] memory _functionSelectors) internal {\\n        require(_functionSelectors.length > 0, \\\"LibDiamondCut: No selectors in facet to cut\\\");\\n        DiamondStorage storage ds = diamondStorage();\\n        // if function does not exist then do nothing and return\\n        require(_facetAddress == address(0), \\\"LibDiamondCut: Remove facet address must be address(0)\\\");\\n        for (uint256 selectorIndex; selectorIndex < _functionSelectors.length; selectorIndex++) {\\n            bytes4 selector = _functionSelectors[selectorIndex];\\n            address oldFacetAddress = ds.selectorToFacetAndPosition[selector].facetAddress;\\n            removeFunction(ds, oldFacetAddress, selector);\\n        }\\n    }\\n\\n    function addFacet(DiamondStorage storage ds, address _facetAddress) internal {\\n        enforceHasContractCode(_facetAddress, \\\"LibDiamondCut: New facet has no code\\\");\\n        ds.facetFunctionSelectors[_facetAddress].facetAddressPosition = ds.facetAddresses.length;\\n        ds.facetAddresses.push(_facetAddress);\\n    }    \\n\\n\\n    function addFunction(DiamondStorage storage ds, bytes4 _selector, uint96 _selectorPosition, address _facetAddress) internal {\\n        ds.selectorToFacetAndPosition[_selector].functionSelectorPosition = _selectorPosition;\\n        ds.facetFunctionSelectors[_facetAddress].functionSelectors.push(_selector);\\n        ds.selectorToFacetAndPosition[_selector].facetAddress = _facetAddress;\\n    }\\n\\n    function removeFunction(DiamondStorage storage ds, address _facetAddress, bytes4 _selector) internal {        \\n        require(_facetAddress != address(0), \\\"LibDiamondCut: Can't remove function that doesn't exist\\\");\\n        // an immutable function is a function defined directly in a diamond\\n        require(_facetAddress != address(this), \\\"LibDiamondCut: Can't remove immutable function\\\");\\n        // replace selector with last selector, then delete last selector\\n        uint256 selectorPosition = ds.selectorToFacetAndPosition[_selector].functionSelectorPosition;\\n        uint256 lastSelectorPosition = ds.facetFunctionSelectors[_facetAddress].functionSelectors.length - 1;\\n        // if not the same then replace _selector with lastSelector\\n        if (selectorPosition != lastSelectorPosition) {\\n            bytes4 lastSelector = ds.facetFunctionSelectors[_facetAddress].functionSelectors[lastSelectorPosition];\\n            ds.facetFunctionSelectors[_facetAddress].functionSelectors[selectorPosition] = lastSelector;\\n            ds.selectorToFacetAndPosition[lastSelector].functionSelectorPosition = uint96(selectorPosition);\\n        }\\n        // delete the last selector\\n        ds.facetFunctionSelectors[_facetAddress].functionSelectors.pop();\\n        delete ds.selectorToFacetAndPosition[_selector];\\n\\n        // if no more selectors for facet address then delete the facet address\\n        if (lastSelectorPosition == 0) {\\n            // replace facet address with last facet address and delete last facet address\\n            uint256 lastFacetAddressPosition = ds.facetAddresses.length - 1;\\n            uint256 facetAddressPosition = ds.facetFunctionSelectors[_facetAddress].facetAddressPosition;\\n            if (facetAddressPosition != lastFacetAddressPosition) {\\n                address lastFacetAddress = ds.facetAddresses[lastFacetAddressPosition];\\n                ds.facetAddresses[facetAddressPosition] = lastFacetAddress;\\n                ds.facetFunctionSelectors[lastFacetAddress].facetAddressPosition = facetAddressPosition;\\n            }\\n            ds.facetAddresses.pop();\\n            delete ds.facetFunctionSelectors[_facetAddress].facetAddressPosition;\\n        }\\n    }\\n\\n    function initializeDiamondCut(address _init, bytes memory _calldata) internal {\\n        if (_init == address(0)) {\\n            require(_calldata.length == 0, \\\"LibDiamondCut: _init is address(0) but_calldata is not empty\\\");\\n        } else {\\n            require(_calldata.length > 0, \\\"LibDiamondCut: _calldata is empty but _init is not address(0)\\\");\\n            if (_init != address(this)) {\\n                enforceHasContractCode(_init, \\\"LibDiamondCut: _init address has no code\\\");\\n            }\\n            (bool success, bytes memory error) = _init.delegatecall(_calldata);\\n            if (!success) {\\n                if (error.length > 0) {\\n                    // bubble up the error\\n                    revert(string(error));\\n                } else {\\n                    revert(\\\"LibDiamondCut: _init function reverted\\\");\\n                }\\n            }\\n        }\\n    }\\n\\n    function enforceHasContractCode(address _contract, string memory _errorMessage) internal view {\\n        uint256 contractSize;\\n        assembly {\\n            contractSize := extcodesize(_contract)\\n        }\\n        require(contractSize > 0, _errorMessage);\\n    }\\n}\\n\",\"keccak256\":\"0x2205345e83eb86f5281f159a9215a096cb6d404782619f9b8e9d7a4a46c32a37\",\"license\":\"MIT\"}},\"version\":1}",
  "bytecode": "0x608060405234801561001057600080fd5b506124e0806100206000396000f3fe60806040526004361061007b5760003560e01c8063c8eeb5781161004e578063c8eeb578146100f5578063efbb97611461011e578063f6a40d2a1461013e578063f741e19e1461015e57600080fd5b806327ff9f351461008057806383da1d76146100a257806383de6e99146100c25780639253c073146100d5575b600080fd5b34801561008c57600080fd5b506100a061009b366004611fc3565b610171565b005b3480156100ae57600080fd5b506100a06100bd3660046120af565b6102f0565b6100a06100d036600461218c565b610360565b3480156100e157600080fd5b506100a06100f0366004612293565b610b4a565b34801561010157600080fd5b5061010a610f2d565b604051901515815260200160405180910390f35b34801561012a57600080fd5b506100a06101393660046122d0565b610f70565b34801561014a57600080fd5b506100a0610159366004612327565b61111b565b6100a061016c366004612293565b611254565b600081815260008051602061248b833981519152602090815260408083207f35fa70a6f9ae8a4d427ebe0c1be62ffd2870fecc1df41c6fda0bf5803e5628889092528220805491929091610100900460ff1660038111156101d4576101d461234a565b146102265760405162461bcd60e51b815260206004820152601c60248201527f546f6f206c61746520746f206368616e6765205947206f707420696e0000000060448201526064015b60405180910390fd5b33600090815260048201602052604090205460ff166102995760405162461bcd60e51b815260206004820152602960248201527f5061792074686520636f6c6c61746572616c207365637572697479206465706f6044820152681cda5d08199a5c9cdd60ba1b606482015260840161021d565b336000818152600784016020526040808220805460ff81161560ff199091168117909155905190928392909187917f9c0d71d8ccd3ac3b8b8463f9dff1237a9e545a61f6e803ee0948ff02c7cef56691a450505050565b6102f8611d99565b6040517ff27a5986330dc78d016d8604ee1a040d5a789fbaa2d0c27f5dfded4b616b8977908290829061032c908690612360565b90815260405190819003602001902080546001600160a01b03929092166001600160a01b0319909216919091179055505050565b83518351811480156103725750825181145b801561037e5750815181145b6103bf5760405162461bcd60e51b8152602060048201526012602482015271082e4e4c2f2e640c8dedc4ee840dac2e8c6d60731b604482015260640161021d565b6000805b82811015610a985760008782815181106103df576103df61238f565b6020026020010151905060008583815181106103fd576103fd61238f565b60200260200101519050600061041e60008051602061248b83398151915290565b6000848152602091825260408082206001600160a01b03861683526007810190935290205490915060ff1661049f5760405162461bcd60e51b815260206004820152602160248201527f55736572206e6f742070617274206f66207969656c642067656e65726174696f6044820152603760f91b606482015260840161021d565b6000816001016040516104c1906816985e5b95985d5b1d60ba1b815260090190565b908152604051908190036020018120546001600160a01b0316915060009060018401906104fb906605a61796e5a61760cc1b815260070190565b908152602001604051809103902060009054906101000a90046001600160a01b03169050600061055e8c88815181106105365761053661238f565b60200260200101518c89815181106105505761055061238f565b602002602001015186611e22565b9050600081131561068e576040516316d5e29b60e11b815281906000906001600160a01b03851690632dabc5369061059e90889086908d906004016123a5565b6020604051808303816000875af11580156105bd573d6000803e3d6000fd5b505050506040513d601f19601f820116820180604052508101906105e191906123c6565b6001600160a01b03881660009081526008880160205260408120805492935083929091906106109084906123f5565b90915550506001600160a01b0387166000908152600a870160205260408120805483929061063f9084906123f5565b909155506106509050888880611e8b565b80876001600160a01b0316897e94f0db15b32d9d12a13c5a2c4be5153bda7550fd0cbf0abc3fc6a5d0d41d7a60405160405180910390a45050610a87565b6000811215610a875760006106a58260001961240e565b90506000846001600160a01b03166377c7b8fc6040518163ffffffff1660e01b8152600401602060405180830381865afa1580156106e7573d6000803e3d6000fd5b505050506040513d601f19601f8201168201806040525081019061070b91906123c6565b90506000678ac7230489e800008261072485600f61243e565b61072e919061243e565b6107389190612455565b604051631398fee160e31b8152600481018b90529091506000906001600160a01b03881690639cc7f70890602401602060405180830381865afa158015610783573d6000803e3d6000fd5b505050506040513d601f19601f820116820180604052508101906107a791906123c6565b9050346107b48d846123f5565b11156107fe5760405162461bcd60e51b8152602060048201526019602482015278139bdd08195b9bdd59da08115512081d985b1d59481cd95b9d603a1b604482015260640161021d565b604051632af34be360e11b81526001600160a01b038881166004830152602482018c90528716906355e697c69084906044016000604051808303818588803b15801561084957600080fd5b505af115801561085d573d6000803e3d6000fd5b5050505050818c61086e91906123f5565b604051631398fee160e31b8152600481018c9052909c506000906001600160a01b03891690639cc7f70890602401602060405180830381865afa1580156108b9573d6000803e3d6000fd5b505050506040513d601f19601f820116820180604052508101906108dd91906123c6565b905060006001600160a01b038816632dabc5368a886108fc8787612477565b6109069190612477565b8f6040518463ffffffff1660e01b8152600401610925939291906123a5565b6020604051808303816000875af1158015610944573d6000803e3d6000fd5b505050506040513d601f19601f8201168201806040525081019061096891906123c6565b604051631398fee160e31b8152600481018e90529091506000906001600160a01b038b1690639cc7f70890602401602060405180830381865afa1580156109b3573d6000803e3d6000fd5b505050506040513d601f19601f820116820180604052508101906109d791906123c6565b90506109e38482612477565b8714610a315760405162461bcd60e51b815260206004820152601d60248201527f46696e616c2073686172652062616c616e636520696e636f7272656374000000604482015260640161021d565b818f610a3d9190612477565b9e50610a498286612477565b6040516001600160a01b038e16908f907fb661b35109646d6776b783a742f7e50d155cebc74454b6b8ab6dec5cf6f0a2e890600090a4505050505050505b8660010196505050505050506103c3565b5034811015610b4257600033610aae8334612477565b604051600081818185875af1925050503d8060008114610aea576040519150601f19603f3d011682016040523d82523d6000602084013e610aef565b606091505b5050905080610b405760405162461bcd60e51b815260206004820181905260248201527f4661696c656420746f2073656e64206c6566746f76657220455448206261636b604482015260640161021d565b505b505050505050565b610b52611d99565b60005b8151811015610f29576000828281518110610b7257610b7261238f565b602002602001015190506000610b9360008051602061248b83398151915290565b600083815260209190915260409020805490915060ff16610bb8575050600101610b55565b600081600101604051610bda906816985e5b95985d5b1d60ba1b815260090190565b908152604051908190036020018120546001600160a01b031691506000906001840190610c14906605a61796e5a61760cc1b815260070190565b908152604051908190036020019020546003840154600585015460048601546001600160a01b039093169350600092610c4d919061243e565b610c579190612455565b604051631398fee160e31b8152600481018790529091506000906001600160a01b03851690639cc7f70890602401602060405180830381865afa158015610ca2573d6000803e3d6000fd5b505050506040513d601f19601f82011682018060405250810190610cc691906123c6565b9050818111610ce057866001019650505050505050610b55565b600085600601805480602002602001604051908101604052809291908181526020018280548015610d3a57602002820191906000526020600020905b81546001600160a01b03168152600190910190602001808311610d1c575b505050505090506000805b8251811015610f15576000838281518110610d6257610d6261238f565b6020026020010151905060008451836001610d7d91906123f5565b03610d9e5783610d8d8888612477565b610d979190612477565b9050610deb565b60038a01546001600160a01b0383166000908152600b8c016020526040902054610dc88989612477565b610dd2919061243e565b610ddc9190612455565b9050610de881856123f5565b93505b6000886001600160a01b0316632dabc5368b848f6040518463ffffffff1660e01b8152600401610e1d939291906123a5565b6020604051808303816000875af1158015610e3c573d6000803e3d6000fd5b505050506040513d601f19601f82011682018060405250810190610e6091906123c6565b6001600160a01b038416600090815260088d016020526040812080549293508392909190610e8f9084906123f5565b90915550506001600160a01b0383166000908152600a8c01602052604081208054839290610ebe9084906123f5565b90915550610ecf90508c8480611e8b565b80836001600160a01b03168d7fb661b35109646d6776b783a742f7e50d155cebc74454b6b8ab6dec5cf6f0a2e860405160405180910390a4836001019350505050610d45565b508860010198505050505050505050610b55565b5050565b6000610f37611d99565b507f7c039906f7f8ca11e01b6987a88513563589699678f7d2a6c8447f44d69375f3805460ff19811660ff918216159081179092551690565b610f78611d99565b600083815260008051602061248b833981519152602090815260408083207f6751f7e27cecf86d7136f5749c224248cae80a39fafb59f8f6bf12c52816307c9092529091205460ff166110035760405162461bcd60e51b8152602060048201526013602482015272119d5b9908191bd95cc81b9bdd08195e1a5cdd606a1b604482015260640161021d565b6001600160a01b0382166110595760405162461bcd60e51b815260206004820152601860248201527f496e76616c69642070726f766964657220616464726573730000000000000000604482015260640161021d565b816001600160a01b031681600101846040516110759190612360565b908152604051908190036020019020546001600160a01b0316036110d35760405162461bcd60e51b815260206004820152601560248201527453616d652070726f7669646572206164647265737360581b604482015260640161021d565b8181600101846040516110e69190612360565b90815260405190819003602001902080546001600160a01b03929092166001600160a01b031990921691909117905550505050565b60008281527f6751f7e27cecf86d7136f5749c224248cae80a39fafb59f8f6bf12c52816307c6020908152604080832060018101805483518186028101860190945280845291949390919083018282801561119f57602002820191906000526020600020905b81546001600160a01b03168152600190910190602001808311611181575b505050505090506000815190506000805b828110156111fb57336001600160a01b03168482815181106111d4576111d461238f565b60200260200101516001600160a01b0316036111f357600191506111fb565b6001016111b0565b50806112495760405162461bcd60e51b815260206004820181905260248201527f5468652063616c6c6572206d7573742062652061207061727469636970616e74604482015260640161021d565b610b42863387611e8b565b61125c611d99565b6000805b8251811015611cec57600083828151811061127d5761127d61238f565b60200260200101519050600061129e60008051602061248b83398151915290565b600083815260209190915260409020805490915060ff166112c3575050600101611260565b6000816001016040516112e5906816985e5b95985d5b1d60ba1b815260090190565b908152604051908190036020018120546001600160a01b03169150600090600184019061131f906605a61796e5a61760cc1b815260070190565b908152604051908190036020019020546003840154600585015460048601546001600160a01b039093169350600092611358919061243e565b6113629190612455565b604051631398fee160e31b8152600481018790529091506001600160a01b03841690639cc7f70890602401602060405180830381865afa1580156113aa573d6000803e3d6000fd5b505050506040513d601f19601f820116820180604052508101906113ce91906123c6565b81146114365760405162461bcd60e51b815260206004820152603160248201527f63757272656e74546f74616c4465706f73697420646f6573206e6f74206d61746044820152706368206e6565646564207368617265732160781b606482015260840161021d565b60008460060180548060200260200160405190810160405280929190818152602001828054801561149057602002820191906000526020600020905b81546001600160a01b03168152600190910190602001808311611472575b505050505090506000805b82518110156115605760008382815181106114b8576114b861238f565b6020908102919091018101516001600160a01b038116600090815260098b018352604080822054600b8d0190945290205490925080821115611552576114fe8183612477565b61150890866123f5565b6001600160a01b038416600081815260098d0160205260408082208590555192975083928e917fc12f54eeeae0f5ca9f6561845a215b9d282ff63875074a39ac0679eb904bd80491a45b83600101935050505061149b565b508060000361157b5787600101975050505050505050611260565b8086600401600082825461158f91906123f5565b90915550506003860154600587015460048801546115ad919061243e565b6115b79190612455565b604051632af34be360e11b81526001600160a01b038781166004830152602482018a9052919450908516906355e697c69083906044016000604051808303818588803b15801561160657600080fd5b505af115801561161a573d6000803e3d6000fd5b5050604051631398fee160e31b8152600481018b9052600093506001600160a01b0389169250639cc7f7089150602401602060405180830381865afa158015611667573d6000803e3d6000fd5b505050506040513d601f19601f8201168201806040525081019061168b91906123c6565b9050808411156119e8576000866001600160a01b03166377c7b8fc6040518163ffffffff1660e01b8152600401602060405180830381865afa1580156116d5573d6000803e3d6000fd5b505050506040513d601f19601f820116820180604052508101906116f991906123c6565b90506000678ac7230489e80000826117118589612477565b61171c90600f61243e565b611726919061243e565b6117309190612455565b90503461173d8d836123f5565b11156117875760405162461bcd60e51b8152602060048201526019602482015278139bdd08195b9bdd59da08115512081d985b1d59481cd95b9d603a1b604482015260640161021d565b604051632af34be360e11b81526001600160a01b038981166004830152602482018c90528816906355e697c69083906044016000604051808303818588803b1580156117d257600080fd5b505af11580156117e6573d6000803e3d6000fd5b5050505050808c6117f791906123f5565b604051631398fee160e31b8152600481018c9052909c506001600160a01b03891690639cc7f70890602401602060405180830381865afa15801561183f573d6000803e3d6000fd5b505050506040513d601f19601f8201168201806040525081019061186391906123c6565b925060006001600160a01b038816632dabc5368a6118818a88612477565b8e6040518463ffffffff1660e01b81526004016118a0939291906123a5565b6020604051808303816000875af11580156118bf573d6000803e3d6000fd5b505050506040513d601f19601f820116820180604052508101906118e391906123c6565b604051631398fee160e31b8152600481018d90529091506001600160a01b038a1690639cc7f70890602401602060405180830381865afa15801561192b573d6000803e3d6000fd5b505050506040513d601f19601f8201168201806040525081019061194f91906123c6565b871461199d5760405162461bcd60e51b815260206004820152601d60248201527f46696e616c2073686172652062616c616e636520696e636f7272656374000000604482015260640161021d565b6119a7818e612477565b9c506119b38183612477565b60405186908d907fd061db9ba41d1cdaa449d1cc902bdabf9f54ecf0ea1e6f32695e61d70dd039aa90600090a4505050611a9e565b83811115611a9e576001600160a01b038516632dabc53687611a0a8785612477565b8b6040518463ffffffff1660e01b8152600401611a29939291906123a5565b6020604051808303816000875af1158015611a48573d6000803e3d6000fd5b505050506040513d601f19601f82011682018060405250810190611a6c91906123c6565b50600082897fd061db9ba41d1cdaa449d1cc902bdabf9f54ecf0ea1e6f32695e61d70dd039aa60405160405180910390a45b6000805b8451811015611bb7576000858281518110611abf57611abf61238f565b6020908102919091018101516001600160a01b038116600090815260098d018352604080822054600b8f0190945290205490925081811015611b435760405162461bcd60e51b815260206004820152601d60248201527f57697468647261772067726561746572207468616e206465706f736974000000604482015260640161021d565b8b6009016000846001600160a01b03166001600160a01b03168152602001908152602001600020548c600b016000856001600160a01b03166001600160a01b0316815260200190815260200160002054611b9d9190612477565b611ba790866123f5565b9450836001019350505050611aa2565b5080886004015414611c0b5760405162461bcd60e51b815260206004820152601b60248201527f63757272656e74546f74616c4465706f73697420696e76616c69640000000000604482015260640161021d565b60008860030154896005015483611c22919061243e565b611c2c9190612455565b604051631398fee160e31b8152600481018c90529091506001600160a01b03891690639cc7f70890602401602060405180830381865afa158015611c74573d6000803e3d6000fd5b505050506040513d601f19601f82011682018060405250810190611c9891906123c6565b8114611cd75760405162461bcd60e51b815260206004820152600e60248201526d14da185c995cc81a5b9d985b1a5960921b604482015260640161021d565b8a6001019a5050505050505050505050611260565b5034811015610f2957600033611d028334612477565b604051600081818185875af1925050503d8060008114611d3e576040519150601f19603f3d011682016040523d82523d6000602084013e611d43565b606091505b5050905080611d945760405162461bcd60e51b815260206004820181905260248201527f4661696c656420746f2073656e64206c6566746f76657220455448206261636b604482015260640161021d565b505050565b7fc8fcad8db84d3cc18b4c41d551ea0ee66dd599cde068d998e57d5e09332c131c600401546001600160a01b03163314611e205760405162461bcd60e51b815260206004820152602260248201527f4c69624469616d6f6e643a204d75737420626520636f6e7472616374206f776e60448201526132b960f11b606482015260840161021d565b565b6000808260030154836005015486611e3a919061243e565b611e449190612455565b905083811115611e6057611e588482612477565b915050611e84565b83811015611e7e57611e728185612477565b611e589060001961240e565b60009150505b9392505050565b600083815260008051602061248b833981519152602090815260408083206001600160a01b0386168452600a81019092529091205480611f045760405162461bcd60e51b81526020600482015260146024820152734e6f207969656c6420746f20776974686472617760601b604482015260640161021d565b6001600160a01b038481166000908152600a8401602052604080822082905551909185169083908381818185875af1925050503d8060008114611f63576040519150601f19603f3d011682016040523d82523d6000602084013e611f68565b606091505b5050905080611f7657600080fd5b6040516001600160a01b03858116825283919087169088907fdb2460ca9a22614b8fe3f598b727569022250e691340edbbaf8ff069969155f09060200160405180910390a4505050505050565b600060208284031215611fd557600080fd5b5035919050565b634e487b7160e01b600052604160045260246000fd5b604051601f8201601f1916810167ffffffffffffffff8111828210171561201b5761201b611fdc565b604052919050565b600082601f83011261203457600080fd5b813567ffffffffffffffff81111561204e5761204e611fdc565b612061601f8201601f1916602001611ff2565b81815284602083860101111561207657600080fd5b816020850160208301376000918101602001919091529392505050565b80356001600160a01b03811681146120aa57600080fd5b919050565b600080604083850312156120c257600080fd5b823567ffffffffffffffff8111156120d957600080fd5b6120e585828601612023565b9250506120f460208401612093565b90509250929050565b600067ffffffffffffffff82111561211757612117611fdc565b5060051b60200190565b600082601f83011261213257600080fd5b81356020612147612142836120fd565b611ff2565b82815260059290921b8401810191818101908684111561216657600080fd5b8286015b84811015612181578035835291830191830161216a565b509695505050505050565b600080600080608085870312156121a257600080fd5b843567ffffffffffffffff808211156121ba57600080fd5b6121c688838901612121565b95506020915081870135818111156121dd57600080fd5b6121e989828a01612121565b9550506040870135818111156121fe57600080fd5b61220a89828a01612121565b94505060608701358181111561221f57600080fd5b87019050601f8101881361223257600080fd5b8035612240612142826120fd565b81815260059190911b8201830190838101908a83111561225f57600080fd5b928401925b828410156122845761227584612093565b82529284019290840190612264565b979a9699509497505050505050565b6000602082840312156122a557600080fd5b813567ffffffffffffffff8111156122bc57600080fd5b6122c884828501612121565b949350505050565b6000806000606084860312156122e557600080fd5b83359250602084013567ffffffffffffffff81111561230357600080fd5b61230f86828701612023565b92505061231e60408501612093565b90509250925092565b6000806040838503121561233a57600080fd5b823591506120f460208401612093565b634e487b7160e01b600052602160045260246000fd5b6000825160005b818110156123815760208186018101518583015201612367565b506000920191825250919050565b634e487b7160e01b600052603260045260246000fd5b6001600160a01b039390931683526020830191909152604082015260600190565b6000602082840312156123d857600080fd5b5051919050565b634e487b7160e01b600052601160045260246000fd5b80820180821115612408576124086123df565b92915050565b80820260008212600160ff1b8414161561242a5761242a6123df565b8181058314821517612408576124086123df565b8082028115828204841417612408576124086123df565b60008261247257634e487b7160e01b600052601260045260246000fd5b500490565b81810381811115612408576124086123df56fe29d9cba46c358ba7c1b8945751229339792c7c62e3197c240fa98916e75ffbf9a2646970667358221220799bc622b82eee907dd55fe5609a888b2636af26b530f552943ea0be229d685b64736f6c63430008120033",
  "deployedBytecode": "0x60806040526004361061007b5760003560e01c8063c8eeb5781161004e578063c8eeb578146100f5578063efbb97611461011e578063f6a40d2a1461013e578063f741e19e1461015e57600080fd5b806327ff9f351461008057806383da1d76146100a257806383de6e99146100c25780639253c073146100d5575b600080fd5b34801561008c57600080fd5b506100a061009b366004611fc3565b610171565b005b3480156100ae57600080fd5b506100a06100bd3660046120af565b6102f0565b6100a06100d036600461218c565b610360565b3480156100e157600080fd5b506100a06100f0366004612293565b610b4a565b34801561010157600080fd5b5061010a610f2d565b604051901515815260200160405180910390f35b34801561012a57600080fd5b506100a06101393660046122d0565b610f70565b34801561014a57600080fd5b506100a0610159366004612327565b61111b565b6100a061016c366004612293565b611254565b600081815260008051602061248b833981519152602090815260408083207f35fa70a6f9ae8a4d427ebe0c1be62ffd2870fecc1df41c6fda0bf5803e5628889092528220805491929091610100900460ff1660038111156101d4576101d461234a565b146102265760405162461bcd60e51b815260206004820152601c60248201527f546f6f206c61746520746f206368616e6765205947206f707420696e0000000060448201526064015b60405180910390fd5b33600090815260048201602052604090205460ff166102995760405162461bcd60e51b815260206004820152602960248201527f5061792074686520636f6c6c61746572616c207365637572697479206465706f6044820152681cda5d08199a5c9cdd60ba1b606482015260840161021d565b336000818152600784016020526040808220805460ff81161560ff199091168117909155905190928392909187917f9c0d71d8ccd3ac3b8b8463f9dff1237a9e545a61f6e803ee0948ff02c7cef56691a450505050565b6102f8611d99565b6040517ff27a5986330dc78d016d8604ee1a040d5a789fbaa2d0c27f5dfded4b616b8977908290829061032c908690612360565b90815260405190819003602001902080546001600160a01b03929092166001600160a01b0319909216919091179055505050565b83518351811480156103725750825181145b801561037e5750815181145b6103bf5760405162461bcd60e51b8152602060048201526012602482015271082e4e4c2f2e640c8dedc4ee840dac2e8c6d60731b604482015260640161021d565b6000805b82811015610a985760008782815181106103df576103df61238f565b6020026020010151905060008583815181106103fd576103fd61238f565b60200260200101519050600061041e60008051602061248b83398151915290565b6000848152602091825260408082206001600160a01b03861683526007810190935290205490915060ff1661049f5760405162461bcd60e51b815260206004820152602160248201527f55736572206e6f742070617274206f66207969656c642067656e65726174696f6044820152603760f91b606482015260840161021d565b6000816001016040516104c1906816985e5b95985d5b1d60ba1b815260090190565b908152604051908190036020018120546001600160a01b0316915060009060018401906104fb906605a61796e5a61760cc1b815260070190565b908152602001604051809103902060009054906101000a90046001600160a01b03169050600061055e8c88815181106105365761053661238f565b60200260200101518c89815181106105505761055061238f565b602002602001015186611e22565b9050600081131561068e576040516316d5e29b60e11b815281906000906001600160a01b03851690632dabc5369061059e90889086908d906004016123a5565b6020604051808303816000875af11580156105bd573d6000803e3d6000fd5b505050506040513d601f19601f820116820180604052508101906105e191906123c6565b6001600160a01b03881660009081526008880160205260408120805492935083929091906106109084906123f5565b90915550506001600160a01b0387166000908152600a870160205260408120805483929061063f9084906123f5565b909155506106509050888880611e8b565b80876001600160a01b0316897e94f0db15b32d9d12a13c5a2c4be5153bda7550fd0cbf0abc3fc6a5d0d41d7a60405160405180910390a45050610a87565b6000811215610a875760006106a58260001961240e565b90506000846001600160a01b03166377c7b8fc6040518163ffffffff1660e01b8152600401602060405180830381865afa1580156106e7573d6000803e3d6000fd5b505050506040513d601f19601f8201168201806040525081019061070b91906123c6565b90506000678ac7230489e800008261072485600f61243e565b61072e919061243e565b6107389190612455565b604051631398fee160e31b8152600481018b90529091506000906001600160a01b03881690639cc7f70890602401602060405180830381865afa158015610783573d6000803e3d6000fd5b505050506040513d601f19601f820116820180604052508101906107a791906123c6565b9050346107b48d846123f5565b11156107fe5760405162461bcd60e51b8152602060048201526019602482015278139bdd08195b9bdd59da08115512081d985b1d59481cd95b9d603a1b604482015260640161021d565b604051632af34be360e11b81526001600160a01b038881166004830152602482018c90528716906355e697c69084906044016000604051808303818588803b15801561084957600080fd5b505af115801561085d573d6000803e3d6000fd5b5050505050818c61086e91906123f5565b604051631398fee160e31b8152600481018c9052909c506000906001600160a01b03891690639cc7f70890602401602060405180830381865afa1580156108b9573d6000803e3d6000fd5b505050506040513d601f19601f820116820180604052508101906108dd91906123c6565b905060006001600160a01b038816632dabc5368a886108fc8787612477565b6109069190612477565b8f6040518463ffffffff1660e01b8152600401610925939291906123a5565b6020604051808303816000875af1158015610944573d6000803e3d6000fd5b505050506040513d601f19601f8201168201806040525081019061096891906123c6565b604051631398fee160e31b8152600481018e90529091506000906001600160a01b038b1690639cc7f70890602401602060405180830381865afa1580156109b3573d6000803e3d6000fd5b505050506040513d601f19601f820116820180604052508101906109d791906123c6565b90506109e38482612477565b8714610a315760405162461bcd60e51b815260206004820152601d60248201527f46696e616c2073686172652062616c616e636520696e636f7272656374000000604482015260640161021d565b818f610a3d9190612477565b9e50610a498286612477565b6040516001600160a01b038e16908f907fb661b35109646d6776b783a742f7e50d155cebc74454b6b8ab6dec5cf6f0a2e890600090a4505050505050505b8660010196505050505050506103c3565b5034811015610b4257600033610aae8334612477565b604051600081818185875af1925050503d8060008114610aea576040519150601f19603f3d011682016040523d82523d6000602084013e610aef565b606091505b5050905080610b405760405162461bcd60e51b815260206004820181905260248201527f4661696c656420746f2073656e64206c6566746f76657220455448206261636b604482015260640161021d565b505b505050505050565b610b52611d99565b60005b8151811015610f29576000828281518110610b7257610b7261238f565b602002602001015190506000610b9360008051602061248b83398151915290565b600083815260209190915260409020805490915060ff16610bb8575050600101610b55565b600081600101604051610bda906816985e5b95985d5b1d60ba1b815260090190565b908152604051908190036020018120546001600160a01b031691506000906001840190610c14906605a61796e5a61760cc1b815260070190565b908152604051908190036020019020546003840154600585015460048601546001600160a01b039093169350600092610c4d919061243e565b610c579190612455565b604051631398fee160e31b8152600481018790529091506000906001600160a01b03851690639cc7f70890602401602060405180830381865afa158015610ca2573d6000803e3d6000fd5b505050506040513d601f19601f82011682018060405250810190610cc691906123c6565b9050818111610ce057866001019650505050505050610b55565b600085600601805480602002602001604051908101604052809291908181526020018280548015610d3a57602002820191906000526020600020905b81546001600160a01b03168152600190910190602001808311610d1c575b505050505090506000805b8251811015610f15576000838281518110610d6257610d6261238f565b6020026020010151905060008451836001610d7d91906123f5565b03610d9e5783610d8d8888612477565b610d979190612477565b9050610deb565b60038a01546001600160a01b0383166000908152600b8c016020526040902054610dc88989612477565b610dd2919061243e565b610ddc9190612455565b9050610de881856123f5565b93505b6000886001600160a01b0316632dabc5368b848f6040518463ffffffff1660e01b8152600401610e1d939291906123a5565b6020604051808303816000875af1158015610e3c573d6000803e3d6000fd5b505050506040513d601f19601f82011682018060405250810190610e6091906123c6565b6001600160a01b038416600090815260088d016020526040812080549293508392909190610e8f9084906123f5565b90915550506001600160a01b0383166000908152600a8c01602052604081208054839290610ebe9084906123f5565b90915550610ecf90508c8480611e8b565b80836001600160a01b03168d7fb661b35109646d6776b783a742f7e50d155cebc74454b6b8ab6dec5cf6f0a2e860405160405180910390a4836001019350505050610d45565b508860010198505050505050505050610b55565b5050565b6000610f37611d99565b507f7c039906f7f8ca11e01b6987a88513563589699678f7d2a6c8447f44d69375f3805460ff19811660ff918216159081179092551690565b610f78611d99565b600083815260008051602061248b833981519152602090815260408083207f6751f7e27cecf86d7136f5749c224248cae80a39fafb59f8f6bf12c52816307c9092529091205460ff166110035760405162461bcd60e51b8152602060048201526013602482015272119d5b9908191bd95cc81b9bdd08195e1a5cdd606a1b604482015260640161021d565b6001600160a01b0382166110595760405162461bcd60e51b815260206004820152601860248201527f496e76616c69642070726f766964657220616464726573730000000000000000604482015260640161021d565b816001600160a01b031681600101846040516110759190612360565b908152604051908190036020019020546001600160a01b0316036110d35760405162461bcd60e51b815260206004820152601560248201527453616d652070726f7669646572206164647265737360581b604482015260640161021d565b8181600101846040516110e69190612360565b90815260405190819003602001902080546001600160a01b03929092166001600160a01b031990921691909117905550505050565b60008281527f6751f7e27cecf86d7136f5749c224248cae80a39fafb59f8f6bf12c52816307c6020908152604080832060018101805483518186028101860190945280845291949390919083018282801561119f57602002820191906000526020600020905b81546001600160a01b03168152600190910190602001808311611181575b505050505090506000815190506000805b828110156111fb57336001600160a01b03168482815181106111d4576111d461238f565b60200260200101516001600160a01b0316036111f357600191506111fb565b6001016111b0565b50806112495760405162461bcd60e51b815260206004820181905260248201527f5468652063616c6c6572206d7573742062652061207061727469636970616e74604482015260640161021d565b610b42863387611e8b565b61125c611d99565b6000805b8251811015611cec57600083828151811061127d5761127d61238f565b60200260200101519050600061129e60008051602061248b83398151915290565b600083815260209190915260409020805490915060ff166112c3575050600101611260565b6000816001016040516112e5906816985e5b95985d5b1d60ba1b815260090190565b908152604051908190036020018120546001600160a01b03169150600090600184019061131f906605a61796e5a61760cc1b815260070190565b908152604051908190036020019020546003840154600585015460048601546001600160a01b039093169350600092611358919061243e565b6113629190612455565b604051631398fee160e31b8152600481018790529091506001600160a01b03841690639cc7f70890602401602060405180830381865afa1580156113aa573d6000803e3d6000fd5b505050506040513d601f19601f820116820180604052508101906113ce91906123c6565b81146114365760405162461bcd60e51b815260206004820152603160248201527f63757272656e74546f74616c4465706f73697420646f6573206e6f74206d61746044820152706368206e6565646564207368617265732160781b606482015260840161021d565b60008460060180548060200260200160405190810160405280929190818152602001828054801561149057602002820191906000526020600020905b81546001600160a01b03168152600190910190602001808311611472575b505050505090506000805b82518110156115605760008382815181106114b8576114b861238f565b6020908102919091018101516001600160a01b038116600090815260098b018352604080822054600b8d0190945290205490925080821115611552576114fe8183612477565b61150890866123f5565b6001600160a01b038416600081815260098d0160205260408082208590555192975083928e917fc12f54eeeae0f5ca9f6561845a215b9d282ff63875074a39ac0679eb904bd80491a45b83600101935050505061149b565b508060000361157b5787600101975050505050505050611260565b8086600401600082825461158f91906123f5565b90915550506003860154600587015460048801546115ad919061243e565b6115b79190612455565b604051632af34be360e11b81526001600160a01b038781166004830152602482018a9052919450908516906355e697c69083906044016000604051808303818588803b15801561160657600080fd5b505af115801561161a573d6000803e3d6000fd5b5050604051631398fee160e31b8152600481018b9052600093506001600160a01b0389169250639cc7f7089150602401602060405180830381865afa158015611667573d6000803e3d6000fd5b505050506040513d601f19601f8201168201806040525081019061168b91906123c6565b9050808411156119e8576000866001600160a01b03166377c7b8fc6040518163ffffffff1660e01b8152600401602060405180830381865afa1580156116d5573d6000803e3d6000fd5b505050506040513d601f19601f820116820180604052508101906116f991906123c6565b90506000678ac7230489e80000826117118589612477565b61171c90600f61243e565b611726919061243e565b6117309190612455565b90503461173d8d836123f5565b11156117875760405162461bcd60e51b8152602060048201526019602482015278139bdd08195b9bdd59da08115512081d985b1d59481cd95b9d603a1b604482015260640161021d565b604051632af34be360e11b81526001600160a01b038981166004830152602482018c90528816906355e697c69083906044016000604051808303818588803b1580156117d257600080fd5b505af11580156117e6573d6000803e3d6000fd5b5050505050808c6117f791906123f5565b604051631398fee160e31b8152600481018c9052909c506001600160a01b03891690639cc7f70890602401602060405180830381865afa15801561183f573d6000803e3d6000fd5b505050506040513d601f19601f8201168201806040525081019061186391906123c6565b925060006001600160a01b038816632dabc5368a6118818a88612477565b8e6040518463ffffffff1660e01b81526004016118a0939291906123a5565b6020604051808303816000875af11580156118bf573d6000803e3d6000fd5b505050506040513d601f19601f820116820180604052508101906118e391906123c6565b604051631398fee160e31b8152600481018d90529091506001600160a01b038a1690639cc7f70890602401602060405180830381865afa15801561192b573d6000803e3d6000fd5b505050506040513d601f19601f8201168201806040525081019061194f91906123c6565b871461199d5760405162461bcd60e51b815260206004820152601d60248201527f46696e616c2073686172652062616c616e636520696e636f7272656374000000604482015260640161021d565b6119a7818e612477565b9c506119b38183612477565b60405186908d907fd061db9ba41d1cdaa449d1cc902bdabf9f54ecf0ea1e6f32695e61d70dd039aa90600090a4505050611a9e565b83811115611a9e576001600160a01b038516632dabc53687611a0a8785612477565b8b6040518463ffffffff1660e01b8152600401611a29939291906123a5565b6020604051808303816000875af1158015611a48573d6000803e3d6000fd5b505050506040513d601f19601f82011682018060405250810190611a6c91906123c6565b50600082897fd061db9ba41d1cdaa449d1cc902bdabf9f54ecf0ea1e6f32695e61d70dd039aa60405160405180910390a45b6000805b8451811015611bb7576000858281518110611abf57611abf61238f565b6020908102919091018101516001600160a01b038116600090815260098d018352604080822054600b8f0190945290205490925081811015611b435760405162461bcd60e51b815260206004820152601d60248201527f57697468647261772067726561746572207468616e206465706f736974000000604482015260640161021d565b8b6009016000846001600160a01b03166001600160a01b03168152602001908152602001600020548c600b016000856001600160a01b03166001600160a01b0316815260200190815260200160002054611b9d9190612477565b611ba790866123f5565b9450836001019350505050611aa2565b5080886004015414611c0b5760405162461bcd60e51b815260206004820152601b60248201527f63757272656e74546f74616c4465706f73697420696e76616c69640000000000604482015260640161021d565b60008860030154896005015483611c22919061243e565b611c2c9190612455565b604051631398fee160e31b8152600481018c90529091506001600160a01b03891690639cc7f70890602401602060405180830381865afa158015611c74573d6000803e3d6000fd5b505050506040513d601f19601f82011682018060405250810190611c9891906123c6565b8114611cd75760405162461bcd60e51b815260206004820152600e60248201526d14da185c995cc81a5b9d985b1a5960921b604482015260640161021d565b8a6001019a5050505050505050505050611260565b5034811015610f2957600033611d028334612477565b604051600081818185875af1925050503d8060008114611d3e576040519150601f19603f3d011682016040523d82523d6000602084013e611d43565b606091505b5050905080611d945760405162461bcd60e51b815260206004820181905260248201527f4661696c656420746f2073656e64206c6566746f76657220455448206261636b604482015260640161021d565b505050565b7fc8fcad8db84d3cc18b4c41d551ea0ee66dd599cde068d998e57d5e09332c131c600401546001600160a01b03163314611e205760405162461bcd60e51b815260206004820152602260248201527f4c69624469616d6f6e643a204d75737420626520636f6e7472616374206f776e60448201526132b960f11b606482015260840161021d565b565b6000808260030154836005015486611e3a919061243e565b611e449190612455565b905083811115611e6057611e588482612477565b915050611e84565b83811015611e7e57611e728185612477565b611e589060001961240e565b60009150505b9392505050565b600083815260008051602061248b833981519152602090815260408083206001600160a01b0386168452600a81019092529091205480611f045760405162461bcd60e51b81526020600482015260146024820152734e6f207969656c6420746f20776974686472617760601b604482015260640161021d565b6001600160a01b038481166000908152600a8401602052604080822082905551909185169083908381818185875af1925050503d8060008114611f63576040519150601f19603f3d011682016040523d82523d6000602084013e611f68565b606091505b5050905080611f7657600080fd5b6040516001600160a01b03858116825283919087169088907fdb2460ca9a22614b8fe3f598b727569022250e691340edbbaf8ff069969155f09060200160405180910390a4505050505050565b600060208284031215611fd557600080fd5b5035919050565b634e487b7160e01b600052604160045260246000fd5b604051601f8201601f1916810167ffffffffffffffff8111828210171561201b5761201b611fdc565b604052919050565b600082601f83011261203457600080fd5b813567ffffffffffffffff81111561204e5761204e611fdc565b612061601f8201601f1916602001611ff2565b81815284602083860101111561207657600080fd5b816020850160208301376000918101602001919091529392505050565b80356001600160a01b03811681146120aa57600080fd5b919050565b600080604083850312156120c257600080fd5b823567ffffffffffffffff8111156120d957600080fd5b6120e585828601612023565b9250506120f460208401612093565b90509250929050565b600067ffffffffffffffff82111561211757612117611fdc565b5060051b60200190565b600082601f83011261213257600080fd5b81356020612147612142836120fd565b611ff2565b82815260059290921b8401810191818101908684111561216657600080fd5b8286015b84811015612181578035835291830191830161216a565b509695505050505050565b600080600080608085870312156121a257600080fd5b843567ffffffffffffffff808211156121ba57600080fd5b6121c688838901612121565b95506020915081870135818111156121dd57600080fd5b6121e989828a01612121565b9550506040870135818111156121fe57600080fd5b61220a89828a01612121565b94505060608701358181111561221f57600080fd5b87019050601f8101881361223257600080fd5b8035612240612142826120fd565b81815260059190911b8201830190838101908a83111561225f57600080fd5b928401925b828410156122845761227584612093565b82529284019290840190612264565b979a9699509497505050505050565b6000602082840312156122a557600080fd5b813567ffffffffffffffff8111156122bc57600080fd5b6122c884828501612121565b949350505050565b6000806000606084860312156122e557600080fd5b83359250602084013567ffffffffffffffff81111561230357600080fd5b61230f86828701612023565b92505061231e60408501612093565b90509250925092565b6000806040838503121561233a57600080fd5b823591506120f460208401612093565b634e487b7160e01b600052602160045260246000fd5b6000825160005b818110156123815760208186018101518583015201612367565b506000920191825250919050565b634e487b7160e01b600052603260045260246000fd5b6001600160a01b039390931683526020830191909152604082015260600190565b6000602082840312156123d857600080fd5b5051919050565b634e487b7160e01b600052601160045260246000fd5b80820180821115612408576124086123df565b92915050565b80820260008212600160ff1b8414161561242a5761242a6123df565b8181058314821517612408576124086123df565b8082028115828204841417612408576124086123df565b60008261247257634e487b7160e01b600052601260045260246000fd5b500490565b81810381811115612408576124086123df56fe29d9cba46c358ba7c1b8945751229339792c7c62e3197c240fa98916e75ffbf9a2646970667358221220799bc622b82eee907dd55fe5609a888b2636af26b530f552943ea0be229d685b64736f6c63430008120033",
  "devdoc": {
    "kind": "dev",
    "methods": {
      "claimAvailableYield(uint256,address)": {
        "details": "for emergency use only, in case the claimed yield is not sent to the user when withdrawing the collateral",
        "params": {
          "receiver": "The address of the user who will receive the yield",
          "termId": "The term id for which the yield is being claimed"
        }
      },
      "reimburseExtraYield(uint256[])": {
        "params": {
          "termIds": "The term ids for which the yield balance is to be restored"
        }
      },
      "rescueStuckYields(uint256[],uint256[],uint256[],address[])": {
        "params": {
          "originalShares": "The original calculated shares amounts of each bad transaction",
          "originalWithdrawals": "The original ETH withdrawal amounts of each bad transaction",
          "termIds": "The term ids for which the yield is being rescued",
          "users": "The users to be reimbursed"
        }
      },
      "restoreYieldBalance(uint256[])": {
        "params": {
          "termIds": "The term ids for which the yield balance is to be restored"
        }
      },
      "toggleOptInYG(uint256)": {
        "details": "only allowed before the term starts",
        "params": {
          "termId": "The term id for which the yield is being claimed"
        }
      },
      "updateProviderAddressOnTerms(uint256,string,address)": {
        "params": {
          "providerAddress": "The new address of the provider",
          "providerString": "The provider string for which the address is being updated",
          "termId": "The term id for which the yield is being claimed"
        }
      },
      "updateYieldProvider(string,address)": {
        "params": {
          "providerAddress": "The new address of the provider",
          "providerString": "The provider string for which the address is being updated"
        }
      }
    },
    "version": 1
  },
  "userdoc": {
    "kind": "user",
    "methods": {
      "claimAvailableYield(uint256,address)": {
        "notice": "This function allows a user to claim the current available yield"
      },
      "reimburseExtraYield(uint256[])": {
        "notice": "To be used in case of emergency, when there are more shares deposited than expected"
      },
      "rescueStuckYields(uint256[],uint256[],uint256[],address[])": {
        "notice": "To be used in case of emergency, when yield got stuck in the vaultThe position of each array is used as a set in the calculation"
      },
      "restoreYieldBalance(uint256[])": {
        "notice": "To be used in case of emergency, when the user has withdrawn too much eth from yield into the smart contract"
      },
      "toggleOptInYG(uint256)": {
        "notice": "This function allows a user to toggle their yield generation"
      },
      "toggleYieldLock()": {
        "notice": "This function allows the owner to disable the yield generation feature in case of emergency"
      },
      "updateProviderAddressOnTerms(uint256,string,address)": {
        "notice": "To be used in case of emergency, when the provider needs to change the zap or the vault"
      },
      "updateYieldProvider(string,address)": {
        "notice": "This function allows the owner to update the global variable for new yield provider"
      }
    },
    "version": 1
  },
  "storageLayout": {
    "storage": [],
    "types": null
  }
}